Title;Ingredients;Steps;Loves;;;;;;;;;;;;;;
telur Gulung Sosis;2 butir telur--1 buah sosis (ukuran diameter 2cm)--garam--lada--minyak goreng--;Panaskan minyak, lalu goreng sosis dalam ukuran panjang (2-3 menit)--Angkat sosis yang sudah di masak--Goreng telur yang sudah di kocok dan telah di campuri garam dan lada--Setelah telur sudah mulai matang, taruh sosis di atas telur lalu di gulung--Biarkan telur yang di gulung tetap pada wajan, lalu goreng telur kembali sebagai layer bawah--Setelah setengah matang, gulung kembali telur dengan telur yang sebelum nya agar menempel harus setengah matang--Angkat telur lalu potong perlahan karena mudah hancur--telur gulung sosis ready to serve!--;7;;;;;;;;;;;;;"telur Gulung Sosis,2 butir telur--1 buah sosis (ukuran diameter 2cm)--garam--lada--minyak goreng--,""Panaskan minyak, lalu goreng sosis dalam ukuran panjang (¬± 2-3 menit)--Angkat sosis yang sudah di masak--Goreng telur yang sudah di kocok dan telah di campuri garam dan lada--Setelah telur sudah mulai matang, taruh sosis di atas telur lalu di gulung--Biarkan telur yang di gulung tetap pada wajan, lalu goreng telur kembali sebagai layer bawah--Setelah setengah matang, gulung kembali telur dengan telur yang sebelum nya agar menempel harus setengah matang--Angkat telur lalu potong perlahan karena mudah hancur--telur gulung sosis ready to serve!ã--"",7,/id/resep/4464979-telur-gulung-sosis";
telur Penyet Sambel Geprek;1 butir telur ayam--3 lembar selada air--5 buah kerupuk--2 buah cabe rawit--2 buah cabe merah--1 buah bawang putih--Garam--Minyak--;Goreng telur seperti biasa, beri garam secukupnya dan bagian kuning di orek2--Goreng bahan sambal--Cuci bersih selada air, potong sedang--Haluskan sambel, diuleg lebih mantep, beri garam secukupnya--Tambahkan telur dipenyet, selada air dipenyet dan tambahkan kerupuk--;4;;;;;;;;;;;;;"telur Penyet Sambel Geprek,1 butir telur ayam--3 lembar selada air (opsional)--5 buah kerupuk (opsional)--2 buah cabe rawit--2 buah cabe merah--1 buah bawang putih--Garam--Minyak--,""Goreng telur seperti biasa, beri garam secukupnya dan bagian kuning di orek2 (sengaja biar kuningnya merata)--Goreng bahan sambal--Cuci bersih selada air, potong sedang--Haluskan sambel, diuleg lebih mantep, beri garam secukupnya--Tambahkan telur dipenyet, selada air dipenyet dan tambahkan kerupuk--"",4,/id/resep/4465737-telur-penyet-sambel-geprek";
Telur Teri Balado Hijau;4 butir telur rebus--2 lembar daun jeruk (buang tulang daunnya)--1 batang serai (memarkan)--50 ml air--secukupnya garam, kaldu bubuk rasa ayam & gula merah--secukupnya minyak untuk menumis--bumbu halus :--6 siung bawang merah--3 siung bawang putih--10 pcs cabe merah keriting--secukupnya terasi goreng--1 ruas jahe--;Tumis bumbu halus bersama daun jeruk & serai hingga harum & matang. Tambahkan garam,kaldu bubuk & gula merah.--Masukkan telur. Aduk aduk. Koreksi rasa;;;;;;;;;;;;;;"Telur Bumbu Bali,""secukupnya telur yang telah direbus, lalu goreng (saya pakai 4 butir)--2 lembar daun jeruk (buang tulang daunnya)--1 batang serai (memarkan)--50 ml air--secukupnya garam, kaldu bubuk rasa ayam & gula merah--secukupnya minyak untuk menumis--bumbu halus :--6 siung bawang merah--3 siung bawang putih--10 pcs cabe merah keriting--secukupnya terasi goreng--1 ruas jahe--"",""Tumis bumbu halus bersama daun jeruk & serai hingga harum & matang. Tambahkan garam,kaldu bubuk & gula merah.--Masukkan telur. Aduk aduk. Koreksi rasa";
Nasi Goreng Komplit (Sosis, Bakso Ikan dan telur Ceplok);5 telur rebus-- teri--Daun jeruk--Bumbu halus:--Cabe hijau--Cabe rawit--Bawang merah--sedikit Bawang putih--;Goreng telur yang telah direbus. Juga terinya lalu sisihkan--Tumis cabe yang telah dihaluskan sampai matang. Jangan lupa daun jeruk, garam, dan penyedap sesuai selera--Lalu masukkan telur dan teri yang telah di goreng.--Aduk rata dan siap di hidangkan--;2;;;;;;;;;;;;;"Telur Teri Balado Hijau,5 telur rebus--Sejumput teri--Daun jeruk--Bumbu halus:--Cabe hijau--Cabe rawit--Bawang merah--sedikit Bawang putih--,""Goreng telur yang telah direbus. Juga terinya lalu sisihkan--Tumis cabe yang telah dihaluskan sampai matang. Jangan lupa daun jeruk, garam, dan penyedap sesuai selera--Lalu masukkan telur dan teri yang telah di goreng.--Aduk rata dan siap di hidangkan--"",2,/id/resep/4462244-telur-teri-balado-hijau";
Ati Ampela plus telur sambel tomat;1 porsi nasi putih--2 siung bawang merah cincang--1 siung bawang putih cincang--3 bh cabai merah keriting--3 bh cabai rawit--1 bh sosis sapi--3 bh bakso ikan--Irisan kol--1 butir telur--Daun bawang--1 sdm saori saos tiram--2 sdm kecap manis--1/2 sdt saos raja rasa--1 sdt garam--1 sdt royco--;Ceplok telur terlebih dahulu sisihkan, kemudian goreng sosis dan bakso yang sudah dicuci dan dipotong sesuai selera angkat dan sisihkan--Tumis bawang merah, bawang putih dan cabai sampai harum. Kemudian masukkan nasi putih, sosis dan bakso ikan lalu aduk rata--Tambahkan kecap, saori, saos raja rasa, garam, dan royco. Jangan lupa masukkan daun bawang. Aduk rata--Setelah dirasa enak sajikan ke piring, jangan lupa telur ceplok, irisan kol dan taburi bawang goreng--Selamat Mencoba--;7;;;;;;;;;;;;;"Nasi Goreng Komplit (Sosis, Bakso Ikan dan telur Ceplok),1 porsi nasi putih--2 siung bawang merah cincang--1 siung bawang putih cincang--3 bh cabai merah keriting--3 bh cabai rawit--1 bh sosis sapi--3 bh bakso ikan--Irisan kol--1 butir telur--Daun bawang--1 sdm saori saos tiram--2 sdm kecap manis--1/2 sdt saos raja rasa--1 sdt garam--1 sdt royco--,""Ceplok telur terlebih dahulu sisihkan, kemudian goreng sosis dan bakso yang sudah dicuci dan dipotong sesuai selera angkat dan sisihkan--Tumis bawang merah, bawang putih dan cabai sampai harum. Kemudian masukkan nasi putih, sosis dan bakso ikan lalu aduk rata--Tambahkan kecap, saori, saos raja rasa, garam, dan royco. Jangan lupa masukkan daun bawang. Aduk rata--Setelah dirasa enak sajikan ke piring, jangan lupa telur ceplok, irisan kol dan taburi bawang goreng--Selamat Mencoba ä--"",7,/id/resep/4461852-nasi-goreng-komplit-sosis-bakso-ikan-dan-telur-ceplok";
Telur Kukus Praktis dan Sehat;1/4 kg ati ampela ayam--2 butir telur--2 buah tomat (iris kecil memanjang)--Bumbu halus:--4 siung bawang merah--2 siung bawang putih--5 buah cabe merah--Garam--Gula--;Pecahkan telur, kocok kemudian dadar.--Rebus ati ampela, kemudian tiriskan dan goreng--Potong-potong sesuai selera ati Ampela dan telur dadar.--Haluskan bumbu: garam, bawang merah, bawang putih, dan cabe merah--Panaskan minyak goreng dan tumis bumbu halus serta tomat yg telah diiris--Masukkan ati ampela dan telur--Cek rasa, jika pas maka siap disajikan.--;0;;;;;;;;;;;;;"Ati Ampela plus telur sambel tomat,1/4 kg ati ampela ayam--2 butir telur--2 buah tomat (iris kecil memanjang)--Bumbu halus:--4 siung bawang merah--2 siung bawang putih--5 buah cabe merah--Garam--Gula--,""Pecahkan telur, kocok kemudian dadar.--Rebus ati ampela, kemudian tiriskan dan goreng--Potong-potong sesuai selera ati Ampela dan telur dadar.--Haluskan bumbu: garam, bawang merah, bawang putih, dan cabe merah--Panaskan minyak goreng dan tumis bumbu halus serta tomat yg telah diiris--Masukkan ati ampela dan telur--Cek rasa, jika pas maka siap disajikan.--"",0,/id/resep/4461700-ati-ampela-plus-telur-sambel-tomat";
telur dadar sambel pete;1/2 bulatan kol--2 batang daun bawang--2 batang seledri-- royco ayam--2 butir telur-- lada hitam bubuk--;Panaskan air untuk mengkukus--Cuci semua bahan hingga bersih--Potong kol, daun bawang, dan seledri halus dan tipis (agar saat dikukus tidak retak).--Kocok telur dan masukan royco ayam dan lada bubuk. aduk rata--Masukan potongan sayur tadi ke adonan telur dan aduk sampai menjadi satu.--Beri minyak pada cetakan kukusan dan ratakan keseuluh bagian dalam cetakan. (dikit saja hanya untuk melapisi agar saat kukusan ingin diangkat tidak lengket)--Masukan adonan ke cetakan dan kukus kurang lebih 30 menit.. (tips: tusukan lidi/pisau kecil untuk mengetahui apakah kukusan sudah matang)--Sajikan--;6;;;;;;;;;;;;;"Telur Kukus Praktis dan Sehat,1/2 bulatan kol--2 batang daun bawang--2 batang seledri--secukupnya royco ayam--2 butir telur--secukupnya lada hitam bubuk--,""Panaskan air untuk mengkukus--Cuci semua bahan hingga bersih--Potong kol, daun bawang, dan seledri halus dan tipis (agar saat dikukus tidak retak).--Kocok telur dan masukan royco ayam dan lada bubuk. aduk rata--Masukan potongan sayur tadi ke adonan telur dan aduk sampai menjadi satu.--Beri minyak pada cetakan kukusan dan ratakan keseuluh bagian dalam cetakan. (dikit saja hanya untuk melapisi agar saat kukusan ingin diangkat tidak lengket)--Masukan adonan ke cetakan dan kukus kurang lebih 30 menit.. (tips: tusukan lidi/pisau kecil untuk mengetahui apakah kukusan sudah matang)--Sajikan--"",6,/id/resep/4461372-telur-kukus-praktis-dan-sehat";
Lumpia isi tahu + telur;2 butir telur ayam--1 papan pete--2 batang daun bawang--Secukupnya garam--Secukupnya royco--Sedikit minyak goreng--Bumbu halus--4 siung bawang merah--2 siung bawang putih--3 buah cabe rawit--3 buah cabe merah--1 buah tomat--1/4 gandu gula merah--;Panaskan minyak. Iris tipis daun bawang, campurkan pada telur. Tambahkan penyedap rasa lalu kocok.--Masukan telur kocok tadi ke penggorengan. Setelah matang angkat, potong sesuai selera, sisihkan.--Uleg bumbu halus. Panaskan sedikit minyak. Masukan penggorengan tambahkan pete, penyedap dan garam oseng oseng sebentar.--Siramkan sambel pete diatas telur dadar. Sajikan.--;4;;;;;;;;;;;;;"telur dadar sambel pete,2 butir telur ayam--1 papan pete--2 batang daun bawang--Secukupnya garam--Secukupnya royco--Sedikit minyak goreng--Bumbu halus--4 siung bawang merah--2 siung bawang putih--3 buah cabe rawit--3 buah cabe merah--1 buah tomat--1/4 gandu gula merah--,""Panaskan minyak. Iris tipis daun bawang, campurkan pada telur. Tambahkan penyedap rasa lalu kocok.--Masukan telur kocok tadi ke penggorengan. Setelah matang angkat, potong sesuai selera, sisihkan.--Uleg bumbu halus. Panaskan sedikit minyak. Masukan penggorengan tambahkan pete, penyedap dan garam oseng oseng sebentar.--Siramkan sambel pete diatas telur dadar. Sajikan.--"",4,/id/resep/4459423-telur-dadar-sambel-pete";
Lumpia rebung, ebi, telur;Bahan kulit :--250 gram tepung terigu--3 sdm tepung kanji / tapioka--3 sdm tepung maizena--1 butir telur--2 sdt garam--4 sdm minyak goreng-- Air--Bahan isian :--3 potong tahu kuning (tahu putih juga bisa)--2 butir telur--5 sdm tepung terigu--2 sdm tepung kanji / tapioka--2 sdt garam--1 sdt gula--3 siung bawang merah--2 siung bawang putih--4 buah cabe --2 sdt kecap asin--2 sdt penyedap rasa --Bahan menggoreng :--500 gram minyak goreng--;Buat adonan kulit, masukkan tepung terigu, tepung kanji, tepung maizena, telur dan garam aduk jadi satu sambil tambahkan air sedikit demi sedikit. Aduk hingga tidak menrintil / adonan mencair semua.--Saring adonan kulit hingga cair dan tidak ada yang merintil. --Kemudian  buat bumbu isian campur cabe, bawang merah, bawang putih, gula dan garang tumbuk jadi satu hingga halus--Haluskan tahu, kemudian tambahkan tepung terigu, tepung kanji, telur, tumbukan bumbu, kecap asin dan penyedap rasa kemudian uleni hingga tercampur semua--Setelah bahan isian jadi, masak kulit luar diteflon satu persatu, sambil dimasukkan isian.--Kemudian setelah semua selesai, goreng lumpia dalam minyak panas. Tunggu hingga berubah warna atau dirasa cukup (sudah matang). Kemudian tiriskan.--Lumpia siap disajikan--;1;;;;;;;;;;;;;"Lumpia isi tahu + telur,Bahan kulit :--250 gram tepung terigu--3 sdm tepung kanji / tapioka--3 sdm tepung maizena--1 butir telur--2 sdt garam--4 sdm minyak goreng--Secukupnya Air--Bahan isian :--3 potong tahu kuning (tahu putih juga bisa)--2 butir telur--5 sdm tepung terigu--2 sdm tepung kanji / tapioka--2 sdt garam (secukupnya)--1 sdt gula (secukupnya)--3 siung bawang merah--2 siung bawang putih--4 buah cabe (sesuai selera / secukupnya)--2 sdt kecap asin--2 sdt penyedap rasa (sesuai selera / secukupnya)--Bahan menggoreng :--500 gram minyak goreng--,""Pertama¬≤ buat adonan kulit, masukkan tepung terigu, tepung kanji, tepung maizena, telur dan garam aduk jadi satu sambil tambahkan air sedikit demi sedikit. Aduk hingga tidak menrintil / adonan mencair semua.--Saring adonan kulit hingga benar¬≤ cair dan tidak ada yang merintil. (Catatan : adonan harus benar¬≤ mencair seperti air)--Kemudian buat isian, pertama¬≤ buat bumbu isian campur cabe, bawang merah, bawang putih, gula dan garang tumbuk jadi satu hingga halus--Haluskan tahu, kemudian tambahkan tepung terigu, tepung kanji, telur, tumbukan bumbu, kecap asin dan penyedap rasa kemudian uleni hingga tercampur semua--Setelah bahan isian jadi, masak kulit luar diteflon satu persatu, sambil dimasukkan isian.--Kemudian setelah semua selesai, goreng lumpia dalam minyak panas. Tunggu hingga berubah warna atau dirasa cukup (sudah matang). Kemudian tiriskan.--Lumpia siap disajikan--"",1,/id/resep/4453740-lumpia-isi-tahu-telur";
Telur cabe ijo;10 lb kulit lumpia --100 gr rebung--25 gr ebi--2 btr telur--3 siung bawang putih-- garam, gula, mecin, lada--;Rebus rebung, potong tipis dan rendam--Potong korek api--Rendam ebi dan tumis bawang merah yg digeprek, masukan ebi, telur kocok dan rebung aduk2 tambahkan bumbu2--Bungkus dng kulit lupia, goreng--Siap dihidangkan--;4;;;;;;;;;;;;;"Lumpia rebung, ebi, telur,""10 lb kulit lumpia (beli jadi)--100 gr rebung--25 gr ebi--2 btr telur--3 siung bawang putih--secukupnya garam, gula, mecin, lada--"",""Rebus rebung, potong tipis dan rendam--Potong korek api--Rendam ebi dan tumis bawang merah yg digeprek, masukan ebi, telur kocok dan rebung aduk2 tambahkan bumbu2--Bungkus dng kulit lupia, goreng--Siap dihidangkan--"",4,/id/resep/4453480-lumpia-rebung-ebi-telur";
Pempek telur no msg;6 butir telur rebus lalu goreng dan sisihkan--3 lembar daun jeruk dan daun salam--2 batang sereh, geprek--1 buah tomat hijau, potong kotak2--5 siung bawang merah, iris tipis--Bumbu yg dihaluskan:--5 buah cabe ijo keriting--5 buah cabe ijo besar--10 buah cabe rawit ijo/sesuai selera jika suka pedas bisa di +--3 siung bawang putih--secukupnya Gula dan garam--1 SDM minyak wijen--;Tumis bawang merah dgn minyak wijen hingga harum, masukkan bumbu halus, daun jeruk, daun salam, sereh dan tomat hijau--Tambahkan sedikit air, jika sdh matang masukkan gula dan garam, koreksi rasa--Kemudian masukkan telur yg sudah direbus dan di goreng--Angkat dan sajikan, siap di santap--;4;;;;;;;;;;;;;"Telur cabe ijo,""6 butir telur rebus lalu goreng dan sisihkan--3 lembar daun jeruk dan daun salam--2 batang sereh, geprek--1 buah tomat hijau, potong kotak2--5 siung bawang merah, iris tipis--Bumbu yg dihaluskan:--5 buah cabe ijo keriting--5 buah cabe ijo besar--10 buah cabe rawit ijo/sesuai selera jika suka pedas bisa di +--3 siung bawang putih--secukupnya Gula dan garam--1 SDM minyak wijen--"",""Tumis bawang merah dgn minyak wijen hingga harum, masukkan bumbu halus, daun jeruk, daun salam, sereh dan tomat hijau--Tambahkan sedikit air, jika sdh matang masukkan gula dan garam, koreksi rasa--Kemudian masukkan telur yg sudah direbus dan di goreng--Angkat dan sajikan, siap di santap moms ã--"",4,/id/resep/4450619-telur-cabe-ijo";
Mie Goreng Sosis Telur;1/2 kg ikan kakap/tengiri--400 gr tepung sagu/tapioka--2 sdm garam& gula pasir--1 gelas air--secukupnya Telur--;Siapkan air rebusan kasih sedikit garam& minyak. Campur ikan,garam,gula &air aduk rata.lalu masukkan tepung aduk rata.--Ambil sedikit adonan bentuk sprt lumpang lalu isi dgn telur--Untuk pempek telur kecil ( telurnya diaduk terlebih dahulu.--Untuk pempek telur besar(kapal selam) ambil adonan 125 gr bentuk sprt lumpang lalu masukkan telur utuh.--Bisa jg dibentuk bulat panjang/pempek lenjer.--Rebus di air yg sdh mendidih--Tips agar pempek tdk kenyal jgn terlalu lma diaduk.trs ksh sdikit minyak spy tdk lengket.--Segera angkat setelah pempeknya naik keatas/ mengapung--;6;;;;;;;;;;;;;"Pempek telur no msg,1/2 kg ikan kakap/tengiri--400 gr tepung sagu/tapioka--2 sdm garam& gula pasir--1 gelas air--secukupnya Telur--,""Siapkan air rebusan ksih sedikit garam& minyak. Campur ikan,garam,gula &air aduk rata.lalu masukkan tepung aduk rata.--Ambil sedikit adonan bentuk sprt lumpang lalu isi dgn telur--Untuk pempek telur kecil ( telurnya diaduk terlebih dhulu.--Untuk pempek telur besar(kapal selam) ambil adonan 125 gr bentuk sprt lumpang lalu masukkan telur utuh.--Bisa jg dibentuk bulat panjang/pempek lenjer.--Rebus di air yg sdh mendidih--Tips agar pempek tdk kenyal jgn terlalu lma diaduk.trs ksh sdikit minyak spy tdk lengket.--Segera angkat setelah pempeknya naik keatas/ mengapung--"",6,/id/resep/3947152-pempek-telur-no-msg";
Sate telur;2 Mie Goreng Instan--2 Butir Telur --3 Sosis Ayam / Sapi --5 Biji Cabai Rawit--Sayur Sawi Putih / Kubis --2 sdt Saos Tiram--Bumbu Mie Instan--;Pisahkan Mie yang mau di rebus dari bumbunya.--Cabai iris kecil2, Sawi Putih / Kubis juga iris tipis2. Potong Sosis dan Kocok Telur.--Goreng telur, sosis lalu setelah di goreng. Sisihkan ke tempat lain. Ganti buat numis cabai, sawi putih / kubis dan bumbu dr mie instan tsb.--Rebus Mie Instan, setelah selesai di rebus. Buang air nya, lalu masukkan di wajan yg sudah ada isinya (sesuai langkah 4). Tambahkan sedikit saos tiram.--Aduk hingga rata dan koreksi rasa. Setelah di koreksi dan sudah OK.--makanan siap di hidangkan. Selamat Makan dan Selamat Mencoba :)--;6;;;;;;;;;;;;;"Mie Goreng Sosis Telur,2 Mie Goreng Instan--2 Butir Telur (sesuai selera)--3 Sosis Ayam / Sapi (sesuai selera)--5 Biji Cabai Rawit (sesuai selera)--Sayur Sawi Putih / Kubis (sesuai selera)--2 sdt Saos Tiram--Bumbunya pake dari Mie Instan yg sudah ada dalam kemasan--,""Jangan lupa Berdoa sesuai keyakinan masing2, kalau saya baca Basmalah dulu.. :)--Pisahkan Mie yang mau di rebus dari bumbunya.--Cabai iris kecil2, Sawi Putih / Kubis juga iris tipis2. Potong Sosis dan Kocok Telur.--Goreng telur, sosis lalu setelah di goreng. Sisihkan ke tempat lain. Ganti buat numis cabai, sawi putih / kubis dan bumbu dr mie instan tsb.--Rebus Mie Instan, setelah selesai di rebus. Buang air nya, lalu masukkan di wajan yg sudah ada isinya (sesuai langkah 4). Tambahkan sedikit saos tiram.--Aduk hingga rata dan koreksi rasa. Setelah di koreksi dan sudah OK.--Alhamdulillah, makanan siap di hidangkan. Selamat Makan dan Selamat Mencoba :)--"",6,/id/resep/4450231-mie-goreng-sosis-telur";
Macaroni telur;4 butir telur--secukupnya Garam--secukupnya Lada bubuk--Air--Tepung sagu / tapioka (setengah SDM)--Tusuk sate / stick--;Kocok telur hingga berbusa sisihkan--Larutkan tepung sagu / tapioka dengan air secukupnya--Tuang larutan tepung kedalam kocokan telur. Tambahkan garam dan lada bubuk. Bisa ditambah penyedap rasa--Siapkan minyak yg cukup banyak. Panaskan.--Setelah panas kecilkan api dan masukan telur kedalam minyak panas--Putar2 stick hingga telur menggulung di badan stick--TIPS: minyak harus banyak, setelah memasukan telur ke dalam minyak harus langsung digulung cepat karena jika telur terlalu matang di minyak membuat telur susah di gulung,--;8;;;;;;;;;;;;;"Sate telur,4 butir telur--secukupnya Garam--secukupnya Lada bubuk--Air--Tepung sagu / tapioka (setengah SDM)--Tusuk sate / stick--,""Kocok telur hingga berbusa sisihkan--Larutkan tepung sagu / tapioka dengan air secukupnya--Tuang larutan tepung kedalam kocokan telur. Tambahkan garam dan lada bubuk. Bisa ditambah penyedap rasa--Siapkan minyak yg cukup banyak. Panaskan.--Setelah panas kecilkan api dan masukan telur kedalam minyak panas--Putar2 stick hingga telur menggulung di badan stick--TIPS: minyak harus banyak, setelah memasukan telur ke dalam minyak harus langsung digulung cepat karena jika telur terlalu matang di minyak membuat telur susah di gulung,--"",8,/id/resep/4443583-sate-telur";
Roti telur keju;3 genggam macaroni telur--1 butir telur--Garam--Kaldu jamur--Bumbu kentang goreng Indofood rasa jagung bakar--Boncabe--;Dalam panci, didihkan air. Rebus macaroni dengan sedikit minyak. Setelah matang tiriskan.--Kocok telur, tambahkan garam, kaldu jamur. Aduk. Tambahkan pula macaroninya. Aduk merata.--Panaskan wajan dengan sedikit minyak. Masukkan macaroni, aduk merata. Masak sampai matang. Sisihkan.--Tambahkan macaroni dengan bumbu kentang goreng indofood, aduk merata. Tambahkan pula dengan boncabe, aduk merata. Koreksi rasa. Jika dirasa cukup, angkat. Sajikan Macaroni Telur dengan taburan keju.. lebih nikmat.--;8;;;;;;;;;;;;;"Macaroni telur,3 genggam macaroni telur--1 butir telur--Garam--Kaldu jamur--Bumbu kentang goreng Indofood rasa jagung bakar--Boncabe--,""Dalam panci, didihkan air. Rebus macaroni dengan sedikit minyak. Setelah matang tiriskan.--Kocok telur, tambahkan garam, kaldu jamur. Aduk. Tambahkan pula macaroninya. Aduk merata.--Panaskan wajan dengan sedikit minyak. Masukkan macaroni, aduk merata. Masak sampai matang. Sisihkan.--Tambahkan macaroni dengan bumbu kentang goreng indofood, aduk merata. Tambahkan pula dengan boncabe, aduk merata. Koreksi rasa. Jika dirasa cukup, angkat. Sajikan Macaroni Telur dengan taburan keju.. lebih nikmat.--"",8,/id/resep/4440566-macaroni-telur";
Kare ayam telur ala mamais;3 butir telur--3 lembar roti tawar--1/2 daun bawang (sesuai selera)--5 lembar daun seledri (sesuai selera)--1/2 tomat--4 cabai merah--secukupnya Garam--Keju secukupnya sesuai selera--20 ml susu cair--Mentega untuk menggoreng--;Cincang kasar cabe, tomat, daun bawang dan daun seledri--Potong roti menjadi lima bagian--Parut keju--Kocok telur dengan bahan cincang, tambahkan susu--Panaskan wajan dan lelehkan mentega--Panggang roti, setelah terpanggang di kedua sisi, tuangkan setengah adonan telur, tunggu beberapa menit--Balik sisi, dan tuangkan telur sisanya--Setelah kedua sisi matang, taburkan keju parut, diamkan beberapa menit di dalam wajan dengan wajan ditutupi, agar kejunya meleleh, kurangi api, agar tidak gosong Ç--Selamat mencoba ä cocok untuk cemilan--Enak disantap dengan saos pedas ç--;5;;;;;;;;;;;;;"Roti telur keju,3 butir telur--3 lembar roti tawar--1/2 daun bawang (sesuai selera)--5 lembar daun seledri (sesuai selera)--1/2 tomat--4 cabai merah--secukupnya Garam--Keju secukupnya sesuai selera--20 ml susu cair--Mentega untuk menggoreng--,""Cincang kasar cabe, tomat, daun bawang dan daun seledri--Potong roti menjadi lima bagian--Parut keju--Kocok telur dengan bahan cincang, tambahkan susu--Panaskan wajan dan lelehkan mentega--Panggang roti, setelah terpanggang di kedua sisi, tuangkan setengah adonan telur, tunggu beberapa menit--Balik sisi, dan tuangkan telur sisanya--Setelah kedua sisi matang, taburkan keju parut, diamkan beberapa menit di dalam wajan dengan wajan ditutupi, agar kejunya meleleh, kurangi api, agar tidak gosong Ç--Selamat mencoba ä cocok untuk cemilan--Enak disantap dengan saos pedas ç--"",5,/id/resep/4395887-roti-telur-keju";
Pare goreng telur udang;1/2 kg ayam potong--5 bh telur rebus-kupas, goreng sebentar berkulit sedikit--2 ruas laos geprek--2 btg sere geprek bag putih--3 daun salam--3 daun jeruk--700 ml santan dari setengah butir kelapa parut--1 sdm gula merah--1 sdt air asam jawa--1/2 sdt garam--1/4 sdt lada bubuk--Kaldu bubuk--1/2 sdt ketumbar bubuk--Bahan pelengkap--Bawang merah goreng--;Tumis bumbu halus bareng ama laos, sere, daun salam, daun jeruk-- masukkan ayam--aduk sampe berubah warna--masukkan telur..aduk rata--tuang santan--tambah gula merah & air asam jawa. --Bumbui garam, lada bubuk, kaldu bubuk, ketumbar bubuk--tes rasa. Masak sampe bumbu meresap dan ayam empuk.--Sajikan dengan taburan bawang goreng.;3;;;;;;;;;;;;;"Kare ayam telur ala mamais,""1/2 kg ayam potong, potong sesuai selera, cuci bersih (ayam kampung lebih haucek)--5 bh telur rebus-kupas, goreng sebentar berkulit sedikit--2 ruas laos geprek--2 btg sere geprek bag putih--3 daun salam--3 daun jeruk--700 ml santan dari setengah butir kelapa parut--1 sdm gula merah--1 sdt air asam jawa--1/2 sdt garam--1/4 sdt lada bubuk--Kaldu bubuk--1/2 sdt ketumbar bubuk--Bumbu halus :--3 sdm bumbu kuning (dasar)- scroll ke bawah resep nya yaaa atau search """"bumbu kuning (dasar)""""--Bahan pelengkap--Bawang merah goreng--"",""Tumis bumbu halus bareng ama laos, sere, daun salam, daun jeruk.. masukkan ayam..aduk sampe berubah warna..masukkan telur..aduk rata..tuang santan..tambah gula merah & air asam jawa. Bumbui garam, lada bubuk, kaldu bubuk, ketumbar bubuk..tes rasa. Masak sampe bumbu meresap dan ayam empuk.--Sajikan dengan taburan bawang goreng. Eh jangan lupa cintanyaaaa.. biar makin nikmat makannya suami sama anak üíïüíïüíïüíïüíï--"",3,/id/resep/4426593-kare-ayam-telur-ala-mamais";
