Title;Ingredients;Steps;Loves;;;;;;;;;;;;;;
Tumis Kornet telur;2 butir telur dadar kocok lepas--1 buah wortel ukurang kecil--100 gr ayam, cincang halus--3 siung bawang merah, iris--2 siung bawang putih, iris--1 cabai merah--1 daun bawang--Garam--Gula----Kaldu bubuk--;Potong dadu kecil wortel, rebus hingga empuk sisihkan--Tumis bwm, bwp, masukkan ayam beri sedikit garam, angkat--Masukan tumisan bawang,ayam, rebusan, wortel, daun bawang ke dalam kocokan telur, beri sedikit garam gula dan kaldu bubuk--Panaskan wajan anti lengket dengan api kecil, masukkan minyak, masukkan bahan no 3 tsb,--Lipat telur sambil ditekan tekan biar dalamnya masak, bolak balik kemudian angkat--Telur dadar isi ayam wortel siap disajikan--;9;;;;;;;;;;;;;"Terik Tempe & Telur,""4 Telur rebus, kupas kulitnya--1 papan tempe--1/2 bungkus santan Kara kecil--Garam--Gula pasir/ gula merah--2 lembar daun salam--Bumbu geprek:--2 ruas jari lengkuas--1 serai--Bumbu halus:--6 siung bawang merah--3 siung bawang putih--2 butir kemiri--1 sdt ketumbar--"",""Tumis bumbu halus, serai, lengkuas, & daun salam sampai harum.--Masukkan tempe, telur rebus, gula, garam, & air. Masak hingga mendidih & bumbu meresap.--Tambahkan santan. Masak lagi hingga mendidih. Tes rasa.--Terik siap dihidangkan.--"",5,/id/resep/4375838-terik-tempe-telur";
Orak-arik Telur Kuah Pedas;4 Telur rebus, kupas kulitnya--1 papan tempe--1/2 bungkus santan Kara kecil--Garam--Gula pasir/ gula merah--2 lembar daun salam--Bumbu geprek:--2 ruas jari lengkuas--1 serai--Bumbu halus:--6 siung bawang merah--3 siung bawang putih--2 butir kemiri--1 sdt ketumbar--;Tumis bumbu halus, serai, lengkuas, & daun salam sampai harum.--Masukkan tempe, telur rebus, gula, garam, & air. Masak hingga mendidih & bumbu meresap.--Tambahkan santan. Masak lagi hingga mendidih. Tes rasa.--Terik siap dihidangkan.--;5;;;;;;;;;;;;;"Tumis Kornet telur,1 kaleng kornet--2 butir telur ayam dikocok lepas--4 siung bawang nerah diiris--2 siung bawang putih diiris--Cabe secukupnya sesuai selera--Penyedap--Minyak goreng--,""telur yang sdh dikocok lepas lalu digoreng aduk2 sampai matang--Kornet digoreng setengah matang--Tumis bawang merah, bawang putih dan cabe, setelah keluar aroma baru masukkan telur orak arik dan kornet.--Tambahkan penyedap, Aduk sampai bumbu meresap--Cicipi dan rasakan, jika sdh enak angkat dan sajikan--"",9,/id/resep/4375555-tumis-kornet-telur";
Telur kukus;1 kaleng kornet--2 butir telur ayam dikocok lepas--4 siung bawang nerah diiris--2 siung bawang putih diiris--Cabe secukupnya sesuai selera--Penyedap--Minyak goreng--;telur yang sdh dikocok lepas lalu digoreng aduk2 sampai matang--Kornet digoreng setengah matang--Tumis bawang merah, bawang putih dan cabe, setelah keluar aroma baru masukkan telur orak arik dan kornet.--Tambahkan penyedap, Aduk sampai bumbu meresap--Cicipi dan rasakan, jika sdh enak angkat dan sajikan--;9;;;;;;;;;;;;;"Opor telur tahu,6 buah telur ayam--1 kotak tahu putih--1 sasect santan instan--üåªbumbu halus--6 butir bawang merah--3 siung bawang putih--4 cm kunyit bakar--1 cm jahe--1/4 sdm merica bubuk--secukupnya Guoa garam--1 ruas sereh--1 buah daun salam--Minyak secukupnya untuk menumis bumbu--,""Rebus telur hingga matang lalu kupas dan sisikan--Goreng tahu hingga kecoklatan dan tiriskan--Tumis bumbu halus dengan sedikit minyak masukkan sereh, daun salam dan bumbu halus tumis hingga wangi--Bila sudah wangi masukkan telur dan tahu, tambahkan sedikit air tunggu hingga bumbu meresap--Bila sudah mendidih dan bumbu meresap masukkan santan aduk jangan sampai pecah tunggu hingga tanak lalu angkat dan sajikan dengan taburan bawang goreng--"",3,/id/resep/4375559-opor-telur-tahu";
telur sambel kecap kuah jagung;2 butir telur ayam--Sayuran apa saja  potong2--1 siung besar bawang putih cincang--2 siung kecil bawang merah cincang--4 buah cabe rawit merah--1 sdt kecap manis--1 sdm saus sambal botolan--secukupnya Garam--secukupnya Gula pasir--secukupnya Air--Minyak untuk menumis--;Tumis bawang merah, bawang putih & cabe hingga harum.--Masukkan telur, aduk2 hingga menggumpal jadi orak-arik.--Tambahkan sayuran dan air sesuai selera.--Masukkan bumbu2 garam, gula, kecap manis, saos sambal, koreksi rasanya.--Masak hingga sayuran layu & kuah mengental. Angkat, sajikan selagi panas.--;3;;;;;;;;;;;;;"Tumis buncis telur..,15 batang buncis--1 butir telur--4 siung bawang putih--1/2 butir bawang bombay--1/2 butir tomat--2 sdm minyak sayur--150 ml air matang--1/4 sdt garam--1/4 sdt masako rasa ayam--,""Potong-potong buncis melintang--Tumis bawang bombay dan bawang putih hingga harum--Masukkan telur dan orak arik hingga matang--Tuang air lalu masukkan garam dan masako--Masukkan buncis dan tomat, masak hingga matang dan empuk--"",31,/id/resep/4373282-tumis-buncis-telur";
Bandeng Presto Balur Telur;4 butir telur--1 buah tomat--1 buah wortel--1 bulatan brokoli--1 sosis yang besar--5 helai daun bawang--4 siung bawang merah--2 siung bawang putih--1/2 sendok teh merica--1/2 bungkus masako rasa ayam--;Parut wortel dengan parutan keju--Potong kecil brokoli--Potong kecil dadu tumat--Iris daun bawang--Iris tipis sosis--Aduk semua bahan dengan telur tambahkan bumbu kemudian kukus--;2;;;;;;;;;;;;;"Tumis Tahu Telur Toge,""3 bh tahu kuning, potong sesuai selera--1 bh telur ayam--2 genggam tauge--2 bh bawang merah--1 bh bawang putih--5 cm daun bawang--1 sdm minyak goreng--Gula--Garam--Lada bubuk--opsional Penyedap--1 sdt kecap manis--2 bh cabai merah--"",""Tumis duo bawang dan cabai hingga harum--Masukkan telur, kocok acak--Masukkan potongan tahu--Masak hingga tahu matang--Tambahkan seperempat gelas air (takaran gelas belimbing)--Masukkan tauge--Masak hingga matang dan air sat--Tambahkan garam, gula pasir, lada bubuk, penyedap, kecap manis--Koreksi rasa--Sajikan--"",12,/id/resep/4372388-tumis-tahu-telur-toge";
Capcay daging telur ala ala.. Å;8 telur ayam--1 buah tomat hijau(yg kecil)--20 cabe rawit hijau kecil--6 buah cabe rawit merah--60 ml kecap bango--3 lembar daun jeruk--secukupnya Air--Sejumput garem--1/2 bawang bombay--5 buah bawang merah--4 buah bawang putih-- Minyak goreng--1/2 jagung manis--;Siapkan wajan beri sedikit minyak goreng Dadar telur satu persatu taburi sedikit garam disetiap telur lalu sisihkan--Iris tipis bawang merah,bawang putih. Iris bulat cabe rawit ijo dan rawit merah lalu iris memanjang daun jeruk dan bawang bombai. Sisihkan--Iris kotak tomat hijau dan sisir jagung sisihkan--Tumis bawang merah,bawang putihbawang bawang bombai,cabe,daun jeruk tambahkan kecap aduk lalu tambahkan air dan garem secukupnya tunggu sampai mendidih lalu masukkan telur nya secara bertahap sampe terendam lalu angkat lagi sisihkan sisakan kuahnya biarkan diwajan--Biarkan api tetap menyala bersama kuah yg ada diwajan tambahkan lagi jagung dan tomat hijaunya biarkan mendidih lalu matikan api--Tuang kuah jagungnya ke atas telur yg tadi sudah disisihkan terlebih dahulu--Siap dihidangkan--Selamat mencoba. ;2;;;;;;;;;;;;;"Bandeng Presto Balur Telur,""Bahan bandeng presto:--1 kg ikan bandeng, /ekor dipotong jadi 2 atau3 bagian, bersihkan--10 cm lengkuas, geprek--3 lembar daun salam--3 batang serai geprek--1.5 sdm garam--5 cm kunyit, bersihkan, geprek--10 cm jahe, bersihkan, geprek--Bahan baluran telur:--2 butir telur--1 sdt kaldu ayam bubuk--Minyak untuk menggoreng--secukupnya Air--"",""Masukkan ikan bandeng, bumbu rempah dan garam ke dalam panci presto, isi dengan air yang cukup banyak hinggak ikan terendam semua, presto selama 1.5-2 jam, tergantung presto, cek jangan sampai air habis dan gosong--Matikan api setelah ikan dipresto, dinginkan, bandeng presto hisa langsung digoreng atau disimpan dikulkas--Kocok telur dan kaldu ayam bubuk hingga rata--Panaskan minyak dalam wajan--Masukkan bandeng presto dalam baluran telur, goreng hingga telur berwarna kecoklatan--Tips agar telur bisa krispi setelah matang, masukkan bandeng presto+telur dalam minyak yang benar-benar panas--Bandeng presto balur telur siap disajikan dengan sambal--"",4,/id/resep/1587590-bandeng-presto-balur-telur";
Bayam Orek Telur;Bahan bandeng presto:--1 kg ikan bandeng, /ekor dipotong jadi 2 atau3 bagian, bersihkan--10 cm lengkuas, geprek--3 lembar daun salam--3 batang serai geprek--1.5 sdm garam--5 cm kunyit, bersihkan, geprek--10 cm jahe, bersihkan, geprek--Bahan baluran telur:--2 butir telur--1 sdt kaldu ayam bubuk--Minyak untuk menggoreng-- Air--;Masukkan ikan bandeng, bumbu rempah dan garam ke dalam panci presto, isi dengan air yang cukup banyak hinggak ikan terendam semua, presto selama 1.5-2 jam, tergantung presto, cek jangan sampai air habis dan gosong--Matikan api setelah ikan dipresto, dinginkan, bandeng presto hisa langsung digoreng atau disimpan dikulkas--Kocok telur dan kaldu ayam bubuk hingga rata--Panaskan minyak dalam wajan--Masukkan bandeng presto dalam baluran telur, goreng hingga telur berwarna kecoklatan--Tips agar telur bisa krispi setelah matang, masukkan bandeng presto+telur dalam minyak yang benar-benar panas--Bandeng presto balur telur siap disajikan dengan sambal--;4;;;;;;;;;;;;;"Oseng Tempe & Telur Kecap,""1 papan tempe--2 butir Telur, kocok lepas--1 buah Daun bawang, cincang--Bahan bumbu :--4 siung Bawang merah--3 siung Bawang putih--Seruas lengkuas, geprek--2 lbr Daun salam--3 buah Cabe rawit, potong--3 sdm Kecap manis--Secukupnya Gula, garam, lada--"",Goreng setengah matang potongan tempe. Angkat. Sisihkan. Goreng telur dicampur daun bawang dan sedikit garam. Potong. Sisihkan.--Tumis bawang merah dan bawang putih hingga wangi. Beri bumbu lain. Masukkan sedikit air. Koreksi rasa.--Masukkan tempe dan telur. Aduk rata. Angkat. Sajikan.--,21,/id/resep/4371411-oseng-tempe-telur-kecap";
Daging Tumis Telur Pete;1/4 daging sapi direbus--1 telur ayam--5 bongkol pakcoy ukuran kecil--200 gr brokoli--2 buah wortel--4 biji cabai rawit--Bumbu halus :--3 siung bawang putih--1 sendok teh merica--Penyedap :-- Garam-- Gula pasir-- Saos sambal--;Tumis bumbu halus sampai wangi--Masukkan cabai rawit, aduk--Masukkan telur, aduk--Masukkan wortel, brokoli, pakcoy, aduk hingga layu, tambahkan air sedikit--Masukkan penyedap, cek rasa--Masak hingga matang, siap dihidangkan--;0;;;;;;;;;;;;;"Bubur telur,1 butir bawang putih di geprek--Bawang bombai di potong 1/4 saja--2-3 centong Nasi--sesuai selera Garam--sesuai selera Royko--1 butir Telur--Keju parut--180 ml Air--Air Kaldu bila ada bisa sapi atau ayam 180 ml utk rasa gurih--,""Tumis bawang putih dan bawang bombay sampai harum--Masukan 180 ml air /air kaldu ke dalam panci lalu didihkan--Setelah itu masukan nasi ke dalam panci sambil dihancurkan nasinya--Masak sampai airnya berkurang tapi jangan sampai kering--Masukan telur 1 butir, aduk rata dengan bubur--Masukan royko dan garam--Cek rasanya--Ini sebetulnya bubur dasar dan anda bisa tambahkan apa yang anda mau. Spt ayam suwiran atau cakwe. Tp kalau saya cukup di tambahkan keju dan saus tomat--Bubur anda siap disajikan--"",2,/id/resep/4369264-bubur-telur";
Sambal terong asam+telur;1 genggam bayam--1 telur--1 bawang putih--2 bawang merah--Secukupnya garam--Secukupnya penyedap--;Kocok telur, garam,penyedap. Sisihkan--Tumis duo bawang,cabe sampai harum. Masukkan bayam sampai layu.--Masukkan telur kocok, aduk2 sampai matang--;6;;;;;;;;;;;;;Telur risik ala saya üëå,3 bh telur ayam (me ayam kampung)--3 bh bawang merah iris--3 bwh beng putih cincang halus--1 bh cabai merah iris serong--1 bh cabai hijau iris serong--1 hlai daun bawang iris--1/2 tomat iris kotak--2 sdm saos tiram--1 sdm kecap manis--1/2 sdm kecap asin (boleh skip kasi garam aja)--Sedikit gula--Sedikit garam--,Siap kan teflon tumis semua bahan kecuali telur...kalo sudah harum dan layu masukan saos tiram kecap manis dan asinnya aduk sebentar lalu ratakan dlm teflon masukan telur satu persatu beri garam sedikit diatas telur2nyaa (jng diaduk2 ya) tutup teflon nya dan kecilkan api masak hingga telur matang....telur risik siap dihidangkan...--,5,/id/resep/4366806-telur-risik-ala-saya-%F0%9F%91%8C;
Kerak telur;1 buah bawang bombay potong halus--3 buah cabe rawit--200 gr daging sapi--100 gr pete--1 buah telur ayam--1/2 sdm garam--1/2 sdm kecap manis--1 sdm kecap inggris--1/2 sdm lada putih--3 sdm minyak jagung--Air putih--;Tumis bawang bombay dan cabe yg sudah dipotong kecil hingga setengah layu dan harum, kemudian masukan daging sapi, dan tumis bersama.--Setelah itu masukan air putih secukupnya, kemudian masak daging hingga lembut, setelah itu tambahkan pete.--Sambil menunggu daging, masukan telur ayam ke dalam wadah dan kocok dengan sendok. Setelah itu tuang ke dalam tumisan, dan aduk rata.--Masukan semua bumbu, garam, lada, kecap manis, kecap inggris. Kemudian aduk, tunggu hingga meresap.--Siap disajikan--;6;;;;;;;;;;;;;"Telur Kecap,1/4 kg Telur ayam--2 siung bawang putih--5 siung bawang merah--1 buah jagung manis--1/2 batang sereh--1 ruas jahe (+/- 5cm)--5 buah cabe merah--5 buah cabe rawit jawa--1/2 buah bawang bombay--secukupnya Kecap manis--secukupnya Garam gula lada--2 buah daun salam--,""Rebus telur ayam hingga matang, lalu kupas kulitnya. Goreng telur dalam minyak panas (saya biasanya digoreng lagi biar lebih crisypy)--Iris tipis semua bahan (bawang merah, bawang putih, bawang bombay, cabe rawit dan cabe merah) Sisir jagung lalu cuci bersih, gerek jahe dan sereh--Panaskan minyak dengan api kecil, lalu masukkan bawang bombay tumis hingga harum, masukkan bawang putih, bawang merah tumis hingga layu, kemudian masukkan cabe merah dan cabe rawit--Tuang air sekitar 600ml (sesuai selera) tunggu sampai mendidih, kemudian masukkan jagung dan telur. Aduk2 hingga bumbu tercampur lalu masukkan jahe daun salam dan sereh. Tambahkan kecap garam gula lada sesuai selera. Tunggu sampai kuahn mengental lalu matikan api dan telur Kecap siap dinikmati--"",6,/id/resep/4366038-telur-kecap";
Telur Rumput Laut;1 buah terong asam--5 siung bawang merah--2 siung bawang putih--10 cabai merah--2 buah telur-- Garam--Gula merah atau gula pasir--1/2 trasi udang sachetan abc-- Kecap asin--;Siapkan alat dan bahan semuanya. Terong dicuci, dikupas lalu dipotong dadu kecil2.--Bawang merah, bawang putih, cabai, trasi, dan garam dihaluskan lalu setelah halus masukkan terong kedalam bumbu halus tadi, ditumbuk bersama hingga bumbu menempel pada terong tersebut kalau bisa terong juga hancur.--Panaskan sedikit minyak untuk menggoreng telur, telur dimasukkan lalu diorak-arik dan bumbu yg dihaluskan serta terong tadi dimasukkan lalu ditambah air sdikit kedalam ulekan tdi.. Lalu dioseng rata dikasih gula secukupnya, kecap asin secukupnya, cicipi sesuai selera..--Siap dihidangkan;2;;;;;;;;;;;;;"Balado Telur & Teri,6 butir telur--1/2 ons ikan teri--4 siung bawang merah--3 siung bawang putih--1 ons cabe merah (selera)--15 cabe rawit--1/2 buah tomat--Minyak goreng--1 sdm gula putih--Garam--Penyedap masakan--,""Rebus telur hingga matang ¬± 15 menit. Kupas. Sisihkan.--Goreng ikan teri sampai garing. Sisihkan.--Haluskan bawang merah, bawang putih, cabe merah, cabe rawit, dan tomat.--Panaskan minyak. Tumis bumbu yang sudah dihaluskan tadi. Tambahkan gula, garam, dan penyedap masakan. Masak hingga bumbu matang.--Masukkan telur dan teri, aduk-aduk sebentar hingga matang.--Angkat. Sajikan.--"",5,/id/resep/4364058-balado-telur-teri";
Indomie goreng telur pedas rawit;1 butir telur ayam kocok--3 sdm ebi/udang kering--2 sdm keju parut halus--1 sachet saus sambal--Secukupnya totole-- butter atau mentega--;Kocok telur beri totole--Panaskan teflon dan butter hingga meleleh--Dadar telur, taburi ebi, lalu keju parut semprot saus sambal--Bolak balik hingga kering--Selesai--;8;;;;;;;;;;;;;"Sarang burung dari Telur DEBM #6,4 butir telur ayam--1 Wortel--1/2 ons toge--Daun bawang--Penyedap rasa--,""Bersihkan wortel, toge, daun bawang sampai bersih.. Kemudian parut wortel dengan menggunakan parutan keju dan iris daun bawangnya juga..--Kocok telur kemudian masukkan wortel, toge dan daun bawangnya dan masukkan penyedap rasa kemudian di aduk..--Masukkan ke dalam cetakan.. Dan kukus sampai teksturnya keras.. Bisa ditekan tekan pakai sendok..--Setelah matang bisa langsung digoreng--Selamat mencoba ä--"",4,/id/resep/4363651-sarang-burung-dari-telur-debm-6";
Sop oyong telur non MSG;3 buah Telur--1 lembar Rumput Laut ukuran besar (utk buat sushi)--1 sdt kaldu ayam--3 sdm air putih--;Siapkan bahan. Campur semua bahan di wadak kecuali rumput laut dan kocok rata--Panaskan wajan dan beri 1 sdm minyak. Dengan api sedang, tuang telur, sampai setengah matang taruh rumput laut diatasnya--Gulung perlahan2 dengan sumpit. Terus masak dengan api sedang sampai telurnya set dan permukaan agak coklat.--Potong2 dan taruh di kotak makan atau piring. Makan dengan nasi, sop, dan sambal.--;0;;;;;;;;;;;;;"Rolade tahu telur mi,10 buah tahu putih--2 butir telur untuk adonan--1 butir telur dikocok untuk pencelup--3 siung bawang putih--Sepucuk sdt mrica butiran--100 gr mbihun jagung--selera Penyedap--Secukupnya garam--Secukupnya minyak goreng--Secukupnya daun pisang untuk mengukus--3 buah wortel--2 btg daun bawang--,""Haluskan tahu,iris wortel,potong2 daun bawang sisihkan, rebus mbihunya angkat tiriskan sisihka--Uleg bawang,mrica sampai halus campurkan dg tahu yg dudah halus beserta irisan wortel,daun bawang mbihun dan telur aduk sampai tercampur rata tambahkan penyedap garam halus lalu tes rasa sisihkan--Siapkan daun pisang lalu taruh diatasnya dan gulung lalu sematkan dg lidi atas bawah,besar kecilnya selera ya moms..lanjutkan sampai adonan habis(saya jadi 5 gulungan)--Kukus sampai daunya berubah warna angkat dan dinginkan--Setelah dingin potong2 dan celupkan ke kocokan telur lalu goreng sampai matang kering kuning kecoklatan angkat dsn siap disajikan.--"",8,/id/resep/4356017-rolade-tahu-telur-mi";
Oseng Jamur Tiram Tahu telur;1 bungkus indomie goreng--3 buah cabe rawit merah iris iris--1 buah telur ayam di ceplok-- saos sambal-- merica--;Rebus mie bersama cabe rawit, angkat dan tiriskan--Campur mie beserta bumbunya beri tambahan saos sambal dan merica sesuai selera--Aduk rata hidangkan dengan telur ceplok--Selamat mencoba;6;;;;;;;;;;;;;"telur ceplok balado,3 buah telur ayam--3-4 siung bawang merah--3 siung bawah putih--4 buah cabe rawit--7 buah cabe keriting--1/2 buah tomat--1 buah sereh geprek--2-3 buah daun jeruk--Secukupnya air--Secukupnya gula dan garam--Secukupnya minyak--,""Ceplok telur ayam--Haluskan bumbu (boleh diulek/diblender) bawang merah, bawang putih, cabe rawit, cabe keriting, dan tomat--Tumis bumbu yang sudah dihaluskan hingga wangi masukan sereh dan daun jeruk--Masukan telur yang tadi sudah diceplok tambahkan sedikit air, gula dan garam. Aduk hingga bumbu meresap, lalu angkat dan sajikan--"",1,/id/resep/4353770-telur-ceplok-balado";
Sayur Telur Tahu Bumbu Kuning;1 oyong agak muda (diiris)--3 buah wortel segar (diiris)--1/4 bunga kol (diiris)--1 butir telur kocok lepas--4 siung bawang putih--secukupnya Lada bubuk--secukupnya Garam--Bawang goreng untuk taburan (optional)--;Uleg kasar bawang putih dan garam--Tumis bawang sampai harum. Kamudian tambahkan air secukupnya. Masukkan lada. Koreksi rasa. Masukkan wortel yang telah diiris pada air yang mendidih.--Setelah wortel agak empuk masukkan oyong. Dilanjutkan dengan bunga kol nya.--Kocok lepas telur. Dan masukkan ke sayur. Biarkan sampai telur agak masak.--Koreksi rasa dan siap dihidangkan. Taburi bawang goreng.--;9;;;;;;;;;;;;;"1. Kentang dan telur ceplok kecap pedas,""3 telur ayam--1/2 bawang bombay diiris--2 siung bawang putih--3 siung bawang merah--3 cabe merah besar (selera)--5 cabe rawit (selera)--2 helai daun jeruk--2 buah kentang--Kecap, garam, gula, merica, minyak goreng, blueband--"",""Ceplok telur ayam, saya menggunakan blueband--Kupas kentang, potong sesuai selera lalu rendam agar warna nya tidak berubah... Setelah itu panaskan minyak lalu goreng kentang hingga setengah matang.--Cincang semua bawang dan cabe.. Tumis (saya pakai blueband) bombay sampai harum, tambahkan bawang putih, bawang merah dan cabai, aduk hingga matang--Tambah air, daun jeruk dan kecap.. Masukkan telur ceplok dan kentang goreng. Aduk rata.. Bumbui dg garam, gula, merica.. Tes rasa.. Masak sampai air menyusut--"",2,/id/resep/4352366-1-kentang-dan-telur-ceplok-kecap-pedas";
Telur Goreng Kucai;1 bungkus jamur tiram--1 buah tahu--2 butir telur ayam--2 siung bawang putih--6 siung bawang merah--2 buah cabe merah besar--5 buah cabe rawit-- merica bubuk--1 sdt garam--1 sdt kaldu jamur--1 sct kecap -- Air--;Potong tahu menjadi kotak-kotak ukuran kecil. Kemudian goreng hingga garing--Sambil menunggu tahu matang, suir-suir jamur tiram kemudian cuci bersih, tiriskan--Bila tahu sudah matang, angkat dan tiriskan. Kemudian goreng 2 butir telur lalu di orak arik hingga hancur dan matang. Angkat dan tiriskan--Tumis bawang merah, bawang putih dan cabe dengan sedikit minyak sampai harum, masukkan sedikit air, kecap kemudian tunggu hingga mendidih.--Bila air sudah mendidih masukkan jamur, tahu, telur, aduk hingga tercampur rata.--Tambahkan garam, kaldu, merica bubuk. Kemudian koreksi rasa.--Tunggu beberapa menit agar matang sempurna.--Menu siap dihidangkan--;2;;;;;;;;;;;;;Semur tahu + telur,1 bungkus tahu kulit--4 telur di rebus--(bahan ulek)--4 bawang putih--4 bawang merah--ladaku--1 buah kemiri--ketumbar--(bahan pelengkap)--2 gelas air--2 sdm kecap--1 sdt gula pasir--secukupnya gula merah--1 sdt garam--1/2 bungkus royco sapi--,Ulek semua bahan sampai lembut--Tumis bumbu sampai harum dan tambahan air--Setelah agak mendidih masukan tahu kulit dan telur yg sudah di rebus--Tambahan semua bumbu pelengkapnya.--Tunggu kurleb 15 menit sampai bumbu meresap tp jgn sampai air habis ya bun..--Icip rasa dan siapkan mangkuk untuk wadah--Happy cooking ä--,9,/id/resep/4351284-semur-tahu-telur;
Fuyunghai Telur sederhana;1/4 kg telur ayam--1 buah tahu putih--Santan--Garam--Merica--Bumbu penyedap (royco)--Air--3 lembar daun salam--Bumbu yang dihaluskan:--5 siung bawang merah--3 siung bawang putih--3 buah kemiri--1 ruas kunyit--;Rebus telur ayam hingga matang lalu kupas kulitnya.--Potong-potong tahu sesuai selera lalu goreng sebentar agar tahu tidak mudah hancur.--Siapkan minyak goreng lalu masukkan bumbu yang telah dihaluskan, tumis hingga harum dan masukkan daun salam.--Setelah bumbu yang dihaluskan sudah matang & harum, beri air secukupnya lalu aduk hingga rata.--Masukkan telur yang telah direbus dan tahu yang sudah digoreng. Tunggu hingga air mendidih lalu masukkan santan sedikit demi sedikit sambil diaduk.--Beri garam, merica atau bumbu penyedap sesuai selera. Setelah matang, angkat dan sajikan dengan taburan bawang goreng.--;11;;;;;;;;;;;;;"Rendang telur ayam,1/2 kg telur ayam--2 lt santan kental (2 buah kelapa parut)--2 ruas jahe (geprek)--2 ruas lengkuas (geprek)--2 lembar daun salam--2 lembar daun kunir--3 lembar daun jeruk--2 batang sereh (geprek)--2 ruas kayu manis--Bumbu halus :--5 siung bawang putih--8 siung bawang merah--5 cabe merah--1/4 biji pala--1/2 sdt jinten--1 sdm ketumbar bubuk--1 sdt mrica bubuk--2 sdt garam--,""Rebus/ kukus telur kmdn kupas lalu sisihkan.--Haluskan bumbu halus lalu tumis & masukkan bumbu yg lain setelah harum--Masukkan santan kental, aduk2 sampai mengental spt foto baru kmdn masukkan telur rebus, masak terus dg api kecil sampai kuahnya kering--"",12,/id/resep/4343861-rendang-telur-ayam";
Nasi Goreng Telur Blue Band;Nasi--Telur--Blue Band/pengganti minyak--Cabai--Bawang Merah--Bawang Putih-- Garam-- Royco Ayam-- Bawang goreng--;Siapkan bahan (nasi, telur, blue band, cabai, bawang merah, bawang putih, garam, royco ayam, bawang goreng)--Haluskan bawang merah, bawang putih, cabai, garam--Masukkan blue band ke wajan sambil dipanaskan (api kompor dikecilkan)--Masukkan dan tumis bumbu yang sudah dihaluskan--Masukkan telur (diacak) bisa juga diceplok atau didadar (sesuai kesukaan/selera)--Masukkan nasi (campur dengan bahan tdi) aduk hingga merata warna nasinya--Tambahkan royco ayam (jika kurang gurih/asin)--Sajikan di piring dan taburkan bawang goreng--;6;;;;;;;;;;;;;"Sate Telur Gulung / Telur gulung,2 Telur Ayam--50 ML Susu UHT--Tusuk sate--secukupnya Garam--Minyak Goreng--,""Masukan Telur, Garam dan Susu UHT, kedalam mangkuk--Kocok hingga tercampur rata--Jika sudah tercampur semua, siapkan tusuk sate--Panaskan minyak, usahakan minyaknya agak banyak ya--Jika sudah panas, masukan kocokan telur tadi sedikit-sedikit--Siapkan tusuk sate, lalu putar-putar telur agar menempel di tusuk satenya, supaya minyaknya keluar pada saat menggulung sedikit ditekan ya, di pinggir pengorengan--Jadi deh... gampangkan, dijamin sikecil makannya lahap--"",9,/id/resep/4283930-sate-telur-gulung-telur-gulung";
