Title;Ingredients;Steps;Loves;;;;;;;;;;;;;;
Orak arik telur buncis;1 butir telur--10 buncis--3 siung bawang merah--2 siung bawang putih--6 cabe rawit--1 sdm kecap manis--Penyedap rasa--;Haluskan bawang merah, bawang putih dan cabai--Iris buncis sesuai selera--Tumis bumbu halus hingga harum--Masukan buncis hingga agak layu--Masukan penyedap--Masukan telur, lalu campur dengan buncis di orak arik hingga rata.. tunggu sebentar kemudian di orak arik lagi.. --Masukan kecap manis--Masukan air --Koreksi rasa--;1;;;;;;;;;;;;;;
Terik Ayam Tempe Telur;4 sayap ayam--4 buah telur--1/2 papan tempe--Bumbu halus:--5 siung bawang merah--4 siung bawang putih--2 butir kemiri--1/2 sdm ketumbar--Garam--Bumbu lain:--2 cm lengkuas--1 lembar daun salam--1 batang sereh--Gula jawa--Bawang goreng--Minyak--1 bungkus santan kara--Air--5 buah cabe rawit--;Cuci sayap ayam kemudian sisihkan. Rebus telur dan kupas. Sisihkan. Potong tempe sesuai selera. Sisihkan.--Panaskan minyak langsung di dalam panci. Tumis sereh, daun salam, dan lengkuas. Setelah beberapa saat masukkan bumbu halus. Tumis sampai berbau harum. Kemudian masukkan air dan gula jawa dan cabe rawit. Jika air sudah mendidih, masukkan sayap ayam dan telur. Masukkan tempe. Tunggu sampai ayam empuk. Masukkan santan kara. Tunggu beberapa saat. Sesuaikan rasa. Matikan api, dan taburkan bawang goreng.--Terik siap dinikmati;6;;;;;;;;;;;;;;
Telur Kornet;1/2 kaleng kornet--2-3 buah bawang prei--2 butir telur--1 sdm tepung terigu--Cabe rawit--Garam--1/2 sdt Merica--1/2 sdm Saus tiram--;Campur kornet, telur, bawang prei dan cabe yang sudah di iris tipis. Tambahkan garam merica saos tiram dan tepung terigu. Goreng 1 sdm kemudian cek rasa. Adonan siap di goreng. ;7;;;;;;;;;;;;;;
Tahu Telur Surabaya;1 butir telur--1 potong tahu putih goreng setengah matang--1/2 siung bawang putih goreng--1 sdm petis udang--3 sdm kacang tanah goreng--Gula merah--Air--Kucai/seledri--Bawang goreng--Garam--Kecap manis--4 buah cabai rawit goreng--Tauge--Acar--;Uleg kacang, cabai, bawang putih, gula merah, petis. Tambahkan air matang. Aduk hingga rata. Sisihkan--Potong tahu kecil-kecil. Sisihkan--Kocok telur dan garam. Masukkan tahu ke telur. Goreng--Campur telur goreng dan tauge dengan saus kacang. Aduk rata.--Pindah ke piring, tambahkan kecap manis, taburi bawang goreng dan kucai/seledri. Tambahkan acar--;10;;;;;;;;;;;;;;
Telur ceplok masak kecap;4 butir telur--4 siung bawang merah--2 siung bawang putih--1 buah tomat--4 buah cabe merah besar--Kecap--;Ceplok telur lalu sisihkan--Iris tipis dua bawang,cabe dan tomat--Panaskan minyak tumis bumbu sampai harum--Tambahkan kecap masukan telur tambahkan air sampai bumbu meresap--Angkat dan sajikan--;0;;;;;;;;;;;;;;
Sambal telur ayam;1/2 kg telur--6 cabe merah besar--10 cabe rawit--lada--Garam--Gula putih--Kecap manis--3 bawang putih--6 bawang merah--;Rebus telur lalu kupas dan goreng--Rebus cabe merah, rawit, bawang putih, bawang merah, tomat--Lalu haluskan lada garam, dan bumbu yg di rebus tadi--Tumis bumbu sampai harum masukkan penyedap rasa dan gula, aduk rata. Masukkan air matang sedikit lalu masukkan kecap manis sesuai selera dan telur. Tunggu sampai air menyusut. Icip rasa--Sajikan--;6;;;;;;;;;;;;;;
Telur Dadar Padang;3 butir telur ayam--4 sdm kelapa parut,sangrai--2 sdm tepung beras,larutkan dengan sedikit air--1/2 lembar daun kunyit,iris halus--2 batang daun bawang,iris halus--Tambahkan garam dan kaldu bubuk--Bumbu halus :--3 buah cabe merah,giling/iris halus--5 buah bawang merah--3 siung bawang putih--1/2 ruas kunyit--1 sdt kari bubuk--1 sdt ketumbar bubuk--1/2 sdt lada bubuk--;Kocok telur --Masukkan bumbu halus,aduk rata.--Tambahkan bahan lainnya,beri garam dan kaldu bubuk,tes rasa.--Panaskan wajan datar anti lengket dengan api besar,beri minyak goreng.--Setelah minyak panas,tuang kocokan telur,kecilkan api,tutup wajan.--Jika sudah kokoh,balik telur dan masak sisi lainnya hingga matang.--Angkat dan tiriskan.--;39;;;;;;;;;;;;;;
Ceplok telur Saus Asam Manis;2 butir telur--1 ruas wortel --1 siung bawang putih geprek cacah halus--1/2 siung bawang bombay iris tipis--1 sdm saus tomat--1 sdm saus sambel--garam, merica dan kaldu bubuk--gula--30 ml air--;Ceplok telur sisihkan--Tumis bawang putih dan bawang bombay sampai harum lalu masukkan wortel, tumis sampai agak layu--Kecilkan api, tambahkan air dan masukkan saus serta bumbu perasa--Aduk rata dan masak sampai mendidih, lalu siram keatas telur ceplok--;5;;;;;;;;;;;;;;
Telur Bumbu Bali;4-5 butir telur rebus, lalu goreng--2 lembar daun jeruk --1 batang serai--50 ml air--garam, kaldu bubuk rasa ayam & gula merah--minyak--bumbu halus :--6 siung bawang merah--3 siung bawang putih--10 buah cabe merah keriting--terasi goreng--1 ruas jahe--;"Tumis bumbu halus bersama daun jeruk & serai hingga harum & matang. Tambahkan garam,kaldu bubuk & gula merah.--Masukkan telur. Aduk hingga rata. Koreksi rasa
Tuang air. Masak hingga matang sampai air menyusut.--Telur Bumbu Bali siap disajikan.--";49;;;;;;;;;;;;;;
Bihun Telur Gulung;2 butir telur--50 gram bihun--garam--Penyedap rasa--lada bubuk--4 sdm air--Saus--;Masukkan telur, garam, penyedap, lada bubuk dan air kedalam botol. Kocok hingga tercampur rata.--Seduh bihun dengan air panas, diamkan sampe bihun lunak, lalu tiriskan.--Panaskan minyak.--Tuang telur, lalu masukkan bihun. Lakukan gerakan memutar dengan menggunakan tusukan, lalu gulung telur kepinggiran wajan.--Lakukan sampai habis.--Tuangkan saus diatasnya. Hidangan siap dinikmati----;10;;;;;;;;;;;;;;
Semur kering telur kentang;2-4 butir telur--2 buah kentang--3 siung bawang merah--3 siung bawang putih--Kemiri--3 buah cabai merah--Air--Gula pasir--Lada bubuk--Penyedap makanan--Kecap--1 daun salam--;Potong kentang sesuai selera dan rebus bersama dengan telur.--Haluskan bawang merah, bawang putih, cabai, kemiri, dan lada.--Kupas telur--Goreng kentang dan telur yang sudah direbus.--Tumis bumbu yang sudah dihaluskan sampai harum. Kemudian tambahkan daun salam dan air.--Setelah mendidih masukan telur dan kentangnya. Tambahkan kecap.--Tambahkan gula & penyedap rasa, aduk-aduk.--Tunggu sampai kuahnya hilang dan meresap.--Semur kering telur kentang siap dihidangkan!--;7;;;;;;;;;;;;;;
Rendang Telur;4 butir telur--200-250 ml santan--1 lembar daun kunyit--2 lembar daun salam--1 sereh geprek--Gula pasir--1 bungkus bumbu rendang indofood--2 sdm kelapa parut yang disangrai dan ditumbuk halus--Bumbu haluskan :--7 siung bawang merah--1 cm kunyit--1 cm lengkuas--1 cm jahe kupas--2 butir kemiri--4 siung bawang putih--1/2 sdt ketumbar bubuk--1/4 sdt lada bubuk--;Rebus telur,kupas lalu goreng--Tumis bumbu halus hingga harum,masukan daun kunyit,daun salam,sereh,aduk rata,masukan bumbu rendang indofood,tumis hingga bumbu matang.--Masukan telur aduk rata,masukan santan.Adukvagar santan tidak pecah.masukan kelapa parut sangrai yang sudah ditumbuk halus.Beri gula,koreksi rasa--Masak hingga kuah kental.Jika sudah kental matikan kompor.Siap disajikan--;21;;;;;;;;;;;;;;
Buncis Cah Telur;20 buah buncis--4 siung bawang putih cincang--1/4 bawang Bombay iris halus--2 buah cabe merah iris halus--5 buah bakso iris tipis /sosis--Kaldu Ayam--Air panas--1-2 butir telur--;Tumis bawang putih, bawang bombay, cabe merah sampai wangi Masukkan bakso atau sosis.--Masukkan buncis yang sudah di iris, oseng sampai berubah warna, Masukkan sedikit air panas tunggu sampai agak matang, Masukkan bumbu penyedap Dan tes rasa.--Tepikan buncisnya dan Masukkan Telurnya, oseng Telur kemudian balurkan dengan buncisnya.--;6;;;;;;;;;;;;;;
Telur cah tomat;2 butir telur--1 buah tomat --2 siung bawang merah--1/2 siung bawang bombay--2 buah cabe rawit merah--daun bawang--Garam--Merica--Gula--;Tumis bawang merah dan bawang bombay, masukkan telur lalu orak arik dan sisihkan--Tambahkan sedikit minyak disisi lain wajan, masukkan tomat, cabe dan daun bawang lalu aduk2 sampai tomat layu,--Setelah layu, aduk rata dengan telur yg sudah di orak arik, tambahkan garam, merica dan gula, koreksi rasa, sajikan dengan nasi hangat--;2;;;;;;;;;;;;;;
Cah sawi putih campur telur;1 buah sawi putih--2 butir telur--3 siung bawang putih geprek--10 buah cabe merah iris--Air--Garam, gula--;Tumis bawang dan cabe sampai harum.--Sisihkan cabe dan bawang kepinggir wajan, masukkan telur aduk rata kemudian orak arik.--Masukkan sawi aduk sebentar tambahkan air, garam, gula, aduk rata tes rasa. Hidangan siap disajikan--;3;;;;;;;;;;;;;;
Balado ikan pindang balut telur;3 potong ikan pindang salem--2 butir telur--Bumbu yang dihaluskan:--5 bawang merah--4 bawang putih--8 cabe merah--2 tomat--Garam--Kaldu bubuk-- Motto--Gula--;Bersihkan pindang--Kocok telur di wadah lalu masukkan ikan pindang kedalam wadah yang berisi telur dan penyedap rasa--Panaskan minyak lalu goreng pindang lalu sisihkan--Tumis bumbu yang dihaluskan lalu masukkan air, beri garam, gula, kaldu bubuk,motto aduk rata dan masukkan pindang yang digoreng tadi aduk rata--Setelah matang angkat dan tiriskan--;17;;;;;;;;;;;;;;
Telur Sambal Ebi;4 butir telur--5 Bawang Merah--2 Bawang Putih--5 Cabai Rawit--Serai Geprek--Merica Bubuk--Garam--Gula--;Rebus telur sampai matang, kupas lalu Goreng. Sisihkan--Haluskan bawang merah bawang putih dan cabai, lalu tumis sampai harum. Masukkan serai lalu ebi. Berikan Garam , merica lalu gula.--Masukkan telur, aduk sampai rata kemudian tambahkan  air tunggu hingga meresap.--Angkat dan sajikan.--;0;;;;;;;;;;;;;;
Sandwich telur mayo;Roti tawar--2 butir Telur--Mayonaise--Susu kental manis--Garam--Merica bubuk--1/2 Alpukat--1 butir Tomat--;Rebus telur hingga matang, lalu kupas, cincang putih telur sisihkan--Hancurkan kuning telur, tambahkan mayonaise 1 sendok makan,susu, merica bubuk, garam masukkan irisan alpukat, tomat aduk sampai rata--Panggang roti tawar sebentar lalu olesi dengan isian tutup kembali dengan roti, potong segitiga atau sesuai selera--;11;;;;;;;;;;;;;;
Gulai Telur & Kentang;Bumbu halus:--10 buah cabai merah keriting--6 siung bawang merah--6 siung bawang putih--3 cm kunyit--3 cm lengkuas--3 cm jahe--1 sdt ketumbar sangrai--50 ml minyak--Untuk tumisan:--minyak--2 lembar daun salam--5 lembar daun jeruk--2 batang serai--10 buah telur rebus--3 buah kentang rebus--3 buah asam kandis--500 ml santan cair--150 ml santan kental--1 sdm garam--1 sdm merica--1/2 sdm gula--;Rebus telur & kentang. Sisihkan.--Blender kasar semua bumbu halus --Tumis daun salam, daun jeruk, dan serai. Tambahkan garam, lada dan gula.--Tuang bumbu halus dari blender. Tumis sampai harum.--Masukkan telur & kentang. Aduk rata. Lalu tuang santan cair. Aduk dan masukkan asam kandis. Aduk sampai mengental.--Terakhir, masukkan santan kental. Aduk dan angkat asam kandisnya. Tambahkan garam dan gula sesuai selera.--;17;;;;;;;;;;;;;;
Makaroni telur;150 gram makaroni elbow--1 butir telur--1 sdm minyak wijen--air--garam--Bumbu tabur--bumbu balado, jagung bakar,bon cabe--;Didihkan air yg sudah dicampur minyak dan garam. Lalu rebus makaroni hingga matang. Tiriskan--Siapkan wajan, tambahkan minyak lalu masukkan makaroni, tumis hingga setengah kering.--Masukkan telur yang sudah dikocok. Lalu orak arik hingga matang. Tiriskan, kemudian beri bumbu tabur. Siap dimakan--;32;;;;;;;;;;;;;;
Kroket kentang wortel isi telur rebus;500 gram kentang--2 buah wortel--1 batang daun bawang--2 butir telur rebus untuk isian--Minyak goreng--Bumbu halus:--2 siung bawang putih--2 siung bawang merah--1 sdt lada--1 sdt garam--kaldu bubuk rasa ayam--Pelapis:--1 butir telur kocok--100 gram tepung roti--;Potong kentang tebal 1 cm cuci bersih lalu goreng hingga kuning kecoklatan lalu dihaluskan--Potong wortel berbentuk dadu rebus sampai mendidih lalu tiriskan masukkan ke dalam adonan kentang bersama bumbu halus dan daun bawang yang sudah dicincang--Aduk sampai merata kemudian koreksi rasa.bentuk seperti bola-bola lalu diisi dengan telur rebus yg sudah dipotong kecil2 sampai adonan habis baru di celupkan ke dalam telur yang sudah di kocok lalu di baluri tepung roti sembari ditekan agar tepung rotinya menempel sempurna--Lalu goreng dengan api sedang--Setelah kuning kecoklatan angkat tiriskan dan kroketnya siap disajikan--;8;;;;;;;;;;;;;;
Opor tahu telur;9 butir telur, rebus, kupas kulitnya--5 buah tahu putih, potong,goreng sampai berkulit--1 batang sereh--1 ruas jari lengkuas--1 lembar daun salam--1 lembar daun jeruk--santan 65ml--1 liter Air--Bumbu halus :--5 buah bawang merah--2 siung bawang putih--2 butir kemiri--1 ruas jahe--1 ruas kunyit--1/2 sdt lada butiran--1/4 sdt jinten--1 sdm ketumbar--garam, gula dan penyedap rasa ayam--;Siapkan bahan, cuci bumbu halus dan rempah daun, sisihkan.--Tumis bumbu halus hingga harum, setelah itu masukkan sereh, lengkuas, daun salam, daun jeruk, aduk sebentar sampai daun layu, tambahkan air, biarkan mendidih, angkat, sisihkan.--Masak air didalam panci kurang lebih 900 ml hingga mendidih, setelah mendidih masukan tumisan bumbu,aduk sebentar baru telur dan tahu dimasukkan.--Aduk sesekali lalu bumbui garam, gula dan penyedap rasa ayam sesuai selera, tes rasa. Masukkan santan instan diaduk terus sampai mendidih hingga tahu dan telur terlihat berubah warna.--Matikan api, angkat dan sajikan--;103;;;;;;;;;;;;;;
Orak arik telur tumis bawang merah;2 butir telur--100 gr bawang merah--10 buah cabe rawit merah--1 sdt terasi--Garam--Gula pasir--Kaldu bubuk--Minyak--;Panaskan wajan kemudian masukan telur dan buat orak-arik, sisihkan--Panaskan minyak, tumis bawang merah dan cabe rawit hingga harum--Tambahkan terasi, gula pasir, garam dan kaldu bubuk--Koreksi rasa--Masukkan telur orak-arik. Aduk rata. Angkat--;22;;;;;;;;;;;;;;
Stick Tempe telur;1 papan tempe--Baluran:--1 butir telur--2 sdm terigu--Bumbu :--1 siung bawang putih--1/2 sdt lada bubuk--Garam,kaldu bubuk--;Kukus tempe hingga empuk,angkat dan potong sesuai selera--Campurkan telur,terigu dan bumbu aduk rata gunakan sebagai baluran tempe--Goreng hingga kecoklatan,angkat dan sajikan--;29;;;;;;;;;;;;;;
Fuyunghai Telur;4 butir telur ayam--Kol--Daun bawang / kucai-- Tepung serbaguna--Garam--Bahan Saus :--Saus tomat--1/4 sdt Tepung maizena--3 Bawang putih--1 Bawang bombay--Kacang polong--Gula / Garam / Penyedap--air--;Kocok telur masukan garam, tepung, kol dan daun bawang yang sudah di iris. Lalu goreng di wajan--Tumis bawang putih dan bawang bombay sampai harum. setelah harum masukan air dan saos tomat aduk sampai mendidih, lalu masukan gula garam penyedap aduk lagi koreksi rasa, kemudian masukan kacang polong. terakhir masukan larutan maizena. tunggu hingga mengental angkat dan sajikan--;26;;;;;;;;;;;;;;
Daging lapis telur;1/2 kg daging sapi--1 butir telur ayam--1 ruas lengkuas--1 batang serai--5 sdm kecap manis--2 lembar daun salam--2 lembar daun jeruk--1 liter air panas--bumbu halus:--8 butir bawang merah--4 butir bawang putih--4 butir kemiri, sangrai--1 sdm ketumbar bubuk--1/2 sdm merica bubuk--4 buah cabe merah keriting--garam--;Dalam wadah aduk rata daging dengan bumbu halus dan telur diamkan sebentar--Panaskan sedikit minyak dalam wajan, masukkan daging dengan bumbunya, masak hingga berubah warna, masukkan bumbu lainnya--Tuang air, masak hingga daging empuk dan kuah mengental--;16;;;;;;;;;;;;;;
Tumis Jagung Telur;2 buah Jagung Manis--1 butir telur--2 siung bawang merah--1 siung bawang putih--4 buah cabe kriting--4 buah cabe rawit-- Garam dan Kaldu penyedap--;Haluskan Bawang merah dan bawang putih. Lalu iris jagung dan iris cabe.--Langkah pertama panaskan minyak, setelah itu masukan bahan yang telah dihaluskan tadi. Kemudian setelah bahan sudah mulai matang masukan jagung yang telah diiris dan masukan telur. Tambahkan cabe kriting yang sudah diiris dan bumbu penyedap seperti garam dan kaldu.--Aduk hingga matang kemudian sajikan.--;12;;;;;;;;;;;;;;
Telur Balado Ikan Teri;6 butir Telur Ayam--Cabai--Minyak Nabati--5 buah Bawang merah--4 siung Bawang Putih--1/2 sdt Gula .--1 sdt Garam--1 buah Tomat--1 Gengam Ikan Teri--;Rebus Telur hingga Matang.--Kupas kulit telur yg anda rebus tadi.--Setelah dikupas di goreng hinga timbul kulit, lalu Goreng Ikan Teri hingga Garing.--Siapkan Minyak, dan ambil 1 butir bawang merah dan 1 butir bawang putih. Dikupas di potong kemudian cacah sampai halus.--Setelah itu tumis hingga tercium bau harum. Masukkan Bumbu Cabai yang sudah di haluskan. Tambahkan minyak dan penyedap rasa, aduk hingga harum, lalu masukkan telur dan ikan teri aduk sampai merata. Dan siap disajikan.--;19;;;;;;;;;;;;;;
Lodeh labu siam, kacang panjang, ayam, telur dan tahu;1 buah labu siam--5 batang kacang panjang potong--3 butir telur ayam rebus--250 gr ayam--1 kotak tahu--2 lembar daun jeruk--1 batang sereh--1 ruas jari lengkuas--1 lembar daun salam--1 sdt gula--1 sdt garam--500 ml air kaldu--250 ml santan kental--1 sdm minyak--Bumbu halus--5 siung bawang merah--3 siung bawang putih--5 buah cabe merah--1 sdt ketumbar--kunyit--;Panaskan minyak goreng, lalu tumis bumbu halus berserta daun jeruk, daun salam, dan lengkuas. tumis hingga harum--Masukkan ayam, tumis kembali ayam hingga berubah warna. masukkan air kaldu dan santan, lalu biarkan hingga mendidih.--Setelah mendidih, masukkan labu siam dan kacang panjang. diamkan hingga sayur layu.--Masukkan tahu dan telur rebus. tambahkan gula dan garam. masak selama 5 menit.--Setelah 5 menit, koreksi rasa. hidangan siap disajikan.--;61;;;;;;;;;;;;;;
Sarden telur ceplok;3 butir telur--1 kaleng sarden cabe--3 butir bawang putih--3 butir bawang merah--1 genggam kacang polong--3 buah cabe--3 buah cabe hijau--150 ml air hangat--Margarin--1 sdt garam--1 sdt kecap manis--1 sdt bubuk cabe--1 sdt merica bubuk--;Goreng telur, lalu tiriskan--Panaskan margarin lalu tumis bawang putih, bawang merah dan cabe sampai harum, kemudian masukkan kacang polong dan air 50ml--Masukkan sarden, koreksi rasa, kemudian tambahkan air 100ml tunggu mendidih--Masukkan telur, aduk pelan. Tunggu meresap. Siap disajikan.--;5;;;;;;;;;;;;;;
Kari tahu dan telur;Tahu 6/7buah (potong 2)--4 buah Telur--2 buah Kara-- Bumbu kari indofood--2 lembar daun salam--1 Sereh--1/2 jempol Laja(laos)--2 lembar daun jeruk--1 sdt gula--2 sdt garam--Bumbu halus:--1 kemiri--3 bawang putih--2 cm kunyit--7 bawang merah--2 cabe merah besar (sesuai selera)--8 Cabe rawit (sesuai selera)--;Rebus telur hingga matang lalu kupas sisihkan--Goreng tahu hingga matang, sisihkan--Tumis (bumbu halus, salam, sereh, laos, daun jeruk) hingga aroma wanginya tercium. Sisihkan--Didihkan air di panci, lalu masukan tumisan yg tadi--Masukan tahu dan telur ke dalam panci--Masukkan kara dan bumbu indofood aduk hingga merata--Masukkan gula dan garam--Koreksi--Kari tahu dan telur siap disajikan--;3;;;;;;;;;;;;;"Kari tahu dan telur,Tahu 6/7buah (potong 2 mnjd segitiga)/sesuai selera--4 buah Telur--2 buah Kara--secukupnya Bumbu kari indofood--2 lembar daun salam--1 Sereh--1/2 jempol Laja(laos)--2 lembar daun jeruk--1 sdt gula--2 sdt garam--Bumbu halus:--1 kemiri--3 bawang putih--2 cm kunyit--7 bawang merah--2 cabe merah besar (sesuai selera)--8 Cabe rawit (sesuai selera)--,""Rebus telur hingga matang lalu kupas sisihkan--Goreng tahu hingga matang, sisihkan--Tumis (bumbu halus, salam, sereh, laos, daun jeruk) hingga aroma wanginya tercium. Sisihkan--Didihkan air di panci, lalu masukan tumisan yg tadi--Masukan tahu dan telur ke dalam panci--Masukkan kara dan bumbu indofood aduk hingga merata--Masukkan gula dan garam--Koreksi--Kari tahu dan telur siap disajikan ä--"",3,/id/resep/4466992-kari-tahu-dan-telur";
telur ceplok asam jawa;"3 telur;--1 buah tomat--3 buah bawang putih--3 buah bawang merah--3 btg cabe--Daun bawang--3 sdm air asam jawa-- Garam gula dan penyedap--";Ceplok telur sampai garing,sisihkan--Tumis duo bawang dan cabe sampai harum kemudian masukan air asam jawa, tambahkan garam gula dan penyedap rasa koreksi rasa--Masukan tomat dan telur, sajikan dengan taburan daun bawang--;6;;;;;;;;;;;;;telur ceplok asam jawa,3 buah telur;"boleh lebih--1 buah tomat--3 buah bawang putih--3 buah bawang merah--3 btg cabe--Daun bawang--3 sdm air asam jawa--secukupnya Garam gula dan penyedap--,""Ceplok telur sampai garing,sisihkan--Tumis duo bawang dan cabe sampai harum kemudian masukan air asam jawa, tambahkan garam gula dan penyedap rasa koreksi rasa--Masukan tomat dan telur, sajikan dengan taburan daun bawang--"",6,/id/resep/4466464-telur-ceplok-asam-jawa"
telur Ceplok Bumbu Pedas;5 butir telur(Ceplok dan beri garam)--2 sdm Bumbu Dasar merah, scroll aja bu, Ada diresep cookpad akuu--2 siung bawang putih--3 siung bawang merah--3 bh rawit merah--Daun Salam, daun jeruk--1 sdt Minyak wijen--2 sdm Minyak goreng--Garam--gula-- penyedap-- merica bubuk-- Air--;Iris tipis, dua bawang rawit--Panaskan wajan, tuang minyak. Tumis urusan dua bawang sampai harum. Masukkan daun jeruk, daun Salam, rawit.--Masukkan Bumbu Dasar merah. Aduk Sampai harum. Tuang Sedikit air, garam gulpas penyedap, Minyak wijen,merica bubuk. Tes rasa--Masukkan telur Ceplok, jangan sering diaduk Aduk. Nanti hancur...--Tunggu Sampai meresap bumbunya.. Sajikan hangat--;3;;;;;;;;;;;;;"telur Ceplok Bumbu Pedas,""5 butir telur, Ceplok kasih garem dikit--2 sdm Bumbu Dasar merah, scroll aja bu, Ada diresep cookpad akuu--2 siung bawang putih--3 siung bawang merah--3 bh rawit merah--Daun Salam, daun jeruk--1 sdt Minyak wijen--2 sdm Minyak goreng--bila suka Garam, gulpas, penyedap--Sedikit merica bubuk--sedikit Air--"",""Iris tips, duo bawang rawit--Panaskan wajan, tuang minyak. Tumis urusan duo bawang sampai harum. Masukkan daun jeruk, daun Salam, rawit.--Masukkan Bumbu Dasar merah. Aduk Sampai harum. Tuang Sedikit air, garam gulpas penyedap, Minyak wijen,merica bubuk. Tes rasa--Masuukan telur Ceplok, jgn sering diaduk Aduk. Ntar ancur...--Tunggu Sampai meresap bumbunya.. Sajikan hangat--"",3,/id/resep/4466573-telur-ceplok-bumbu-pedas";
Telur Ceplok Masak Tauco;8 butir telur ceplok--3 sdm tauco--1 sdm saus tomat--1 sdm saus sambel--6 siung bawang merah, iris tipis--4 siung bawang putih, iris tipis--2 buah cabe besar hijau, iris serong--15 buah cabe rawit, iris serong--1 buah tomat, potong jadi, 8-- air--secukupnya garam--;Tumis bawang merah dan bawang putih hingga harum--Masukkan cabe dan tumis kembali hingga layu, tambahkan air--Masukkan tauco, saus sambel dan saus tomat serta garam. aduk rata--Setelah sedikit mendidih koreksi rasa, jika sudah pas masukkan telur ceplok--Masak hingga air susut--Selamat Mencoba--;1;;;;;;;;;;;;;"Telur Ceplok Masak Tauco,""8 butir telur ceplok--3 sdm tauco--1 sdm saus tomat--1 sdm saus sambel--6 siung bawang merah, iris tipis--4 siung bawang putih, iris tipis--2 buah cabe besar hijau, iris serong--15 buah cabe rawit (kepedasan sesuai selera), iris serong--1 buah tomat, potong jadi, 8--secukupnya air--secukupnya garam--"",""Tumis bawang merah dan bawang putih hingga harum--Masukkan cabe dan tumis kembali hingga layu, tambahkan air--Masukkan tauco, saus sambel dan saus tomat serta garam. aduk rata--Setelah sedikit mendidih koreksi rasa, jika sudah pas masukkan telur ceplok--Masak hingga air susut--Selamat Mencoba ^_*--"",1,/id/resep/4409515-telur-ceplok-masak-tauco";
Semur telur Simpel;7 butir telur ayam--Cabai merah (iris serong)--1/2 sdm gula merah--secukupnya Air--secukupnya Garam--secukupnya Kecap manis--Bumbu halus :--6 siung bawang merah--3 siung bawang putih--2 butir kemiri--1/4 sdt merica--;Ceplok telur satu persatu (telur nya mau direbus juga boleh)--Panaskan sedikit minyak, tumis bumbu halus dan cabai merah hingga harum--Beri sedikit air, masukan telur ceplok tambahkan kecap manis, garam dan gula merah--Tunggu air sedikit menyusut koreksi rasa dan sajikan--;3;;;;;;;;;;;;;"Semur telur Simpel,7 butir telur ayam--Cabai merah (iris serong)--1/2 sdm gula merah--secukupnya Air--secukupnya Garam--secukupnya Kecap manis--Bumbu halus :--6 siung bawang merah--3 siung bawang putih--2 butir kemiri--1/4 sdt merica--,""Ceplok telur satu persatu (telur nya mau direbus juga boleh)--Panaskan sedikit minyak, tumis bumbu halus dan cabai merah hingga harum--Beri sedikit air, masukan telur ceplok tambahkan kecap manis, garam dan gula merah--Tunggu air sedikit menyusut koreksi rasa dan sajikan--"",3,/id/resep/4467783-semur-telur-simpel";
Balado telur;1/4 kg telur--5 buah bamer--3 buat baput--10 buah cabe keriting--1 buah tomat--secukupnya Gula merah--Garam dan penyedap--;Rebus telur kemudian goreng dgn minyak panas--Haluskan semua bumbu kemudian tumis hingga harum--Masukan sedikit air...krmudian masukan telur--Tunggu hingga air hbs...sehingga bumbu meresap ditelur--Telur balado siap disajikan--;1;;;;;;;;;;;;;Balado telur,1/4 kg telur--5 buah bamer--3 buat baput--10 buah cabe keriting--1 buah tomat--secukupnya Gula merah--Garam dan penyedap--,Rebus telur kemudian goreng dgn minyak panas--Haluskan semua bumbu kemudian tumis hingga harum--Masukan sedikit air...krmudian masukan telur--Tunggu hingga air hbs...sehingga bumbu meresap ditelur--Telur balado siap disajikan--,1,/id/resep/4467756-balado-telur;
Telur Gulung Keju;4 butir telur--wortel iris kecil-kecil--1 batang daun bawang iris tipis--1 buah keju slice (potong memanjang)-- garam-- kaldu jamur--;Kocok telur bersama semua bahan (kecuali keju).--Panaskan teflon dan oleskan sedikit minyak. Lebih baik jika mengoleskan minyaknya dengan tissue agak merata dan tidak terlalu banyak minyak.--Tuang 1 sendok sayur telur dan ratakan diwajan, lalu gulung.--Tambahkan keju slice di atasnya dan lalukan secara berulang.--;5;;;;;;;;;;;;;"Telur Gulung Keju,4 butir telur--wortel iris kecil-kecil--1 batang daun bawang iris tipis--1 buah keju slice (potong memanjang)--secukupnya garam--secukupnya kaldu jamur--,""Kocok telur bersama semua bahan (kecuali keju).--Panaskan teflon (saya pakai teflon uk 20) dan oleskan sedikit minyak. Lebih baik jika mengoleskan minyaknya dengan tissue agak merata dan tidak terlalu banyak minyak.--Tuang 1 sendok sayur telur dan ratakan diwajan, lalu gulung.--Tambahkan keju slice di atasnya dan lalukan secara berulang (saya hanya buat 3 lapisan saja).--"",5,/id/resep/4465787-telur-gulung-keju";
