Title;Ingredients;Steps;Loves;;;;;;;;;;;;;;
Cireng+telur mini;pare--Telur--Udang (buang kepalanya)--Minyak--Bumbunya :--Bawang merah (iris tipis)--Bawang putih--Cabe--Tomat--Terasi sedikit aja --Penyedap rasa--Garam--;Iris tipis pare, taruhin garam, remas-remas sampai keluar airnya (biar pahitnya hilang), abis itu cuci bersih parenya, ulangi jika masih berasa pahit--Cuci udang sampai bersih, buang kepalanya--Untuk bumbunya, cabe, terasi, bawang putih, tomat, taruhin garam kemudian di ulek hingga alus--Bawang merah yg sudah diiris tipis goreng hingga layu lalu masukan bumbu yang sudah dihaluskan tadi, tambahkan masako sesuai selera, goreng setengah matang--Lalu masukan udang yg sudah dibersihkan tadi, goreng hingga berubah warna jadi merah, setelah itu masukan parenya, oseng-oseng sebentar lalu masukkan telur kemudian di aduk hingga merata--Masak hingga matang, jangan lupa icip-icip rasanya, dan siap disajikan--;8;;;;;;;;;;;;;"Pare goreng telur udang,pare--Telur (tergantung selera)--Udang (buang kepalanya)--Minyak--Bumbunya :--Bawang merah (iris tipis)--Bawang putih--Cabe--Tomat--Terasi sedikit aja (tergantung selera)--Penyedap rasa (saya pake masako ayam)--Garam--,""Iris tipis pare, taruhin garam, remas-remas sampai keluar airnya (biar pahitnya hilang), abis itu cuci bersih parenya, ulangi jika masih berasa pahit--Cuci udang sampai bersih, buang kepalanya--Untuk bumbunya, cabe, terasi, bawang putih, tomat, taruhin garam kemudian di ulek hingga alus--Bawang merah yg sudah diiris tipis goreng hingga layu lalu masukan bumbu yang sudah dihaluskan tadi, tambahkan masako sesuai selera, goreng setengah matang--Lalu masukan udang yg sudah dibersihkan tadi, goreng hingga berubah warna jadi merah, setelah itu masukan parenya, oseng-oseng sebentar lalu masukkan telur kemudian di aduk hingga merata--Masak hingga matang, jangan lupa icip-icip rasanya, dan siap disajikan--"",8,/id/resep/4426643-pare-goreng-telur-udang";
Lapis Ayam telur kentang;1/4 tepung tapioka--15 sdm terigu--3 bawang putih (halus)--Daun bawang-- Garam,micin--1 butir telur (untuk campuran buat telur mini)-- Air es--Plastik kecil memanjang--;Siapkan wadah masukkan semua bahan tambahkan bumbu. Lalu masukkan air aduk merata sampai agak mengental lalu taburkan daun bawang aduk kembali.--Potong plastik sesuai panjang cireng yg diinginkan. Kemudian sisahkan separuh campur kan telur aduk lagi merata. Untuk membuat telurnya. Masukkan plastik juga. Sama dg cireng tadi.--Langkah terakhir siapkan dandang beri air. Tunggu airnya mendidih lalu masukkan satu persatu gulungan cireng + telur mininya.--Kalau sudah mengapung lalu cek tusuk dengan tusuk gigi. Untuk melihan kematangannya merata atau tidak.--Jika matangnya sudah merata angkat dan tiriskan.--Dimakan tanpa digoreng juga enak. Kalau saya digoreng inilah hasil keduanya. Traalaa--;6;;;;;;;;;;;;;"Cireng+telur mini,""1/4 tepung tapioka--15 sdm terigu--3 bawang putih (halus)--Daun bawang secukupnya(rajang kecil"""")--secukupnya Garam,micin--1 butir telur (untuk campuran buat telur mini)--secukupnya Air es--Plastik kecil memanjang--"",Siapkan wadah masukkan semua bahan tambahkan bumbu. Lalu masukkan air aduk merata sampai agak mengental lalu taburkan daun bawang aduk kembali.--Potong plastik sesuai panjang cireng yg diinginkan. Kemudian sisahkan separuh campur kan telur aduk lagi merata. Untuk membuat telurnya. Masukkan plastik juga. Sama dg cireng tadi.--Langkah terakhir siapkan dandang beri air. Tunggu airnya mendidih lalu masukkan satu persatu gulungan cireng + telur mininya.--Kalau sudah mengapung lalu cek tusuk dengan tusuk gigi. Untuk melihan kematangannya merata atau tidak.--Jika matangnya sudah merata angkat dan tiriskan.--Dimakan tanpa digoreng juga enak. Kalau saya digoreng inilah hasil keduanya. Traalaa--,6,/id/resep/4426305-cirengtelur-mini";
Oseng2 tauge telur;250 gr dada ayam potong sesuai selera--3 butir telur ayam rebus--3 buah kentang, potong2, goreng--1 butir telur ayam mentah--Bumbu halus :--5 siung bawang putih--5 siung bawang merah--1 sdm kacang tanah goreng--secukupnya Garam--secukupnya Lada bubuk--secukupnya Pala parut--secukupnya Gula merah--secukupnya Kecap manis--;Haluskan bawang2an dan garam. Kemudian tambahkan bumbu lainnya. Pecahkan telur mentah. Aduk dg bumbu halus. Tambahkan kecap. Aduk rata--Campur potongan ayam dg bumbu. Siapkan wajan--Tuang ayam yg sdh berbalut bumbu ke wajan. Aduk2 hingga berbau harum. Tambahkan sedikit air. Masukkan telur dan kentang. Biarkan hingga meresap. Angkat dan sajikan.--;10;;;;;;;;;;;;;"Lapis Ayam telur kentang,""250 gr dada ayam potong sesuai selera--3 butir telur ayam rebus--3 buah kentang, potong2, goreng--1 butir telur ayam mentah--Bumbu halus :--5 siung bawang putih--5 siung bawang merah--1 sdm kacang tanah goreng--secukupnya Garam--secukupnya Lada bubuk--secukupnya Pala parut--secukupnya Gula merah--secukupnya Kecap manis--"",Haluskan bawang2an dan garam. Kemudian tambahkan bumbu lainnya. Pecahkan telur mentah. Aduk dg bumbu halus. Tambahkan kecap. Aduk rata--Campur potongan ayam dg bumbu. Siapkan wajan--Tuang ayam yg sdh berbalut bumbu ke wajan. Aduk2 hingga berbau harum. Tambahkan sedikit air. Masukkan telur dan kentang. Biarkan hingga meresap. Angkat dan sajikan.--,10,/id/resep/4424566-lapis-ayam-telur-kentang";
Rica rica telur ikan;2 bungkus tauge/cambah/tokolan--3 siung bawang putih q geprek--4 siung bawang merah --4 buah cabai rawit--1 butir telur-- daun bawang-- penyedap -- garam-- minyak untuk menumis--;Panaskan minyak masukkan telur di orak arik stelah matang sisihkan telur--Tumis bawang putih,bawang merah dan cabai sampai layu dan harum--Setelah harum masukan taugenya lalu tambahkan garam,penyedap setelah tauge layu masukkan telur dan daun bawang tumis sebentar lalu angkat.....--Sajikan bersama nasi hangat--;4;;;;;;;;;;;;;"Oseng2 tauge telurüëç(orak arik tokolan),2 bungkus tauge/cambah/tokolan--3 siung bawang putih q geprek--4 siung bawang merah q iris--4 buah cabai rawit q iris lebih pedes lebih enakããã--1 butir telur--Secukupnya daun bawang--Secukupnya penyedap (q biasa pke kobe bumbu nasgor)--Secukupnya garam--Secukupnya minyak untuk menumis--,""Panaskan minyak masukkan telur di orak arik stelah matang sisihkan telur--Tumis bawang putih,bawang merah dan cabai sampai layu dan harum--Stelah harum masukan taugenya lalu tambahkan garam,penyedap setelah tauge layu masukkan telur dan daun bawang tumis sebentar lalu angkat.....--Sajikan bersama nasi hangat--"",4,/id/resep/4410611-oseng2-tauge-telur%F0%9F%91%8D%F0%9F%91%8D%F0%9F%91%8Dorak-arik-tokolan";
Gulai Telur Tempe Ala2 (Tanpa Santan);1/2 kg telur ikan tengiri--8 siung bawang merah--4 siung bawang putih--5 inc jahe--5 inc kunyit--1/4 sendok teh merica--1/4 sendok teh ketumbar--1 sendok teh garam--1/2 potong gula merah/ 1sendok teh gula pasir--1 serai--1 lembar daun salam--1 potong laos--7 cabai rawit--3 cabai merah besar--5 kemiri--Minyak untuk menumis--;Rebus telur ikan dgn sedikit air +garam dan air jeruk nipis selama 15 menit,angkat potong sesuai selera--Haluskan bumbu bawang merah,bawang putih,jahe,kunyit,garam,cabai rawit dan cabai merah,kemiri, merica dan ketumbar--Tumis semua bumbu yg telah dihaluskan masukan serai,salam,laos,gula,garam sampai berwarna kecokelatan tambahkan sedikit air--Setelah dirasa pas rasanya masukan rebusan telur ikan sambil sesekali d aduk,setelah bumbu meresap angkat sajikan--;7;;;;;;;;;;;;;"Rica rica telur ikan,1/2 kg telur ikan tengiri--8 siung bawang merah--4 siung bawang putih--5 inc jahe--5 inc kunyit--1/4 sendok teh merica--1/4 sendok teh ketumbar--1 sendok teh garam--1/2 potong gula merah/ 1sendok teh gula pasir--1 serai--1 lembar daun salam--1 potong laos--7 cabai rawit--3 cabai merah besar--5 kemiri--Minyak untuk menumis--,""Rebus telur ikan dgn sedikit air +garam dan air jeruk nipis selama 15 menit,angkat potong sesuai selera--Haluskan bumbu bawang merah,bawang putih,jahe,kunyit,garam,cabai rawit dan cabai merah,kemiri, merica dan ketumbar--Tumis semua bumbu yg telah dihaluskan masukan serai,salam,laos,gula,garam sampai berwarna kecokelatan tambahkan sedikit air--Setelah dirasa pas rasanya masukan rebusan telur ikan sambil sesekali d aduk,setelah bumbu meresap angkat sajikan--"",7,/id/resep/4410099-rica-rica-telur-ikan";
Opor Ayam Telur;1 buah Tempe--2 butir Telur--Cabe Rawit Secukupnya--Daun Bawang Secukupnya--Bumbu Gulai -- Garam Halus-- Penyedap Rasa --Gula-- Air--Minyak Makan utk menumis--;Terlebih dahulu rebus 2 butir telur bulat sampai matang, kemudian sisihkan--Panaskan minyak makan kemudian masukkan dan tumis bumbu Gulai--Masukkan cabe rawit yg sudah diiris, tumis bersamaan bumbu gulai--Tambahkan air secukupnya lalu tunggu sampai mendidih--Masukkan tempe yang sudah dirajang + telur (sudah dikupas)--Tambahkan Garam Halus, Penyedap Rasa dan gula, disusul daun bawang--Tunggu sampai mendidih sempurna, Angkat, Siap Disajikan--;6;;;;;;;;;;;;;"Gulai Telur Tempe Ala2 (Tnp Santan),""1 buah Tempe--2 butir Telur--Cabe Rawit Secukupnya (diiris bulat2)--Daun Bawang Secukupnya (dirajang)--Bumbu Gulai (sisa beli dipasar)--Secukupnya Garam Halus--secukupnya Penyedap Rasa (klw saya pakai Royco)--Gula (sedikit, seujung sendok)--Secukupnya Air--Minyak Makan utk menumis--"",""Terlebih dahulu rebus 2 butir telur bulat sampai matang, kemudian sisihkan--Panaskan minyak makan kemudian masukkan dan tumis bumbu Gulai--Masukkan cabe rawit yg sudah diiris, tumis bersamaan bumbu gulai--Tambahkan air secukupnya (sesuai selera) lalu tunggu sampai mendidih--Masukkan tempe yang sudah dirajang + telur (sudah dikupas)--Tambahkan Garam Halus, Penyedap Rasa (sy pakai royco) dan gula, disusul daun bawang--Tunggu sampai mendidih sempurna, Angkat, Siap Disajikan (karena saya suka pedas jadi rawitnya agak banyak, dan gulanya sedikit, semua tergantung selera)--"",6,/id/resep/4410206-gulai-telur-tempe-ala2-tnp-santan";
Bubur Telur (menu balita 8m+);1/2 ayam (potong kecil-kecil)--4 telur rebus--2 lbr salam--1 ruas lengkuas--1 btng serai--1 bks santan kara kecil--Bumbu halus:--5 bawang merah--5 bawang putih--2 kemiri--1 sdt ketumbar--1 ruas kunyit--;Tumis bumbu halus sampai harum, masukan serai lengkuas salam, masukan ayam, tumis sebentar.--Masukan air putih, rebus sampai setengah matang.--Masukan santan dan telur. Bumbui lada garam gula dan kaldu ayam. Rebus sampai ayam matang--Sajikan;12;;;;;;;;;;;;;"Opor Ayam Telur,1/2 ayam (potong kecil-kecil)--4 telur rebus--2 lbr salam--1 ruas lengkuas--1 btng serai--1 bks santan kara kecil--Bumbu halus:--5 bawang merah--5 bawang putih--2 kemiri--1 sdt ketumbar--1 ruas kunyit--,""Tumis bumbu halus sampai harum, masukan serai lengkuas salam, masukan ayam, tumis sebentar.--Masukan air putih, rebus sampai setengah matang.--Masukan santan dan telur. Bumbui lada garam gula dan kaldu ayam. Rebus sampai ayam matang--Sajikan dengan bubur nasi enak, dengan ketupat sambel goreng apalagi!!!--"",12,/id/resep/4395730-opor-ayam-telur";
Mangut Lele dan telur Lele;6 sdm nasi, lumatkan jika ingin tekstur yang lembek--1 butir telur--2 gelas air kaldu/air biasa--1/4 brokoli, iris halus, ambil pucuknya saja--1 sdt EVOO (Extra Virgin Olive Oil)-- Garam-- Gula--Pelengkap:-- Kecap manis-- Bawang goreng--;Masak nasi dengan air kaldu/air biasa dengan api kecil hingga air berkurang 3/4nya--Masukkan telur, aduk cepat--Masukkan brokoli, garam, dan gula. Koreksi rasa. Masak sambil diaduk-aduk hingga konsistensi yang diinginkan, matikan kompor--Tunggu hingga agak dingin lalu masukkan EVOO, aduk rata.--Beri pelengkap Bawang goreng dan kecap manis, sajikan hangat--Bubur Telur siap dinikmati--;8;;;;;;;;;;;;;"Bubur Telur (menu balita 8m+),""6 sdm nasi, lumatkan jika ingin tekstur yang lembek--1 butir telur--2 gelas air kaldu/air biasa--1/4 brokoli, iris halus, ambil pucuknya saja--1 sdt EVOO (Extra Virgin Olive Oil)--secukupnya Garam--secukupnya Gula--Pelengkap:--secukupnya Kecap manis--secukupnya Bawang goreng--"",""Masak nasi dengan air kaldu/air biasa dengan api kecil hingga air berkurang 3/4nya--Masukkan telur, aduk cepat--Masukkan brokoli, garam, dan gula. Koreksi rasa. Masak sambil diaduk-aduk hingga konsistensi yang diinginkan, matikan kompor--Tunggu hingga agak dingin lalu masukkan EVOO, aduk rata.--Beri pelengkap Bawang goreng dan kecap manis, sajikan hangat--Bubur Telur siap dinikmati--"",8,/id/resep/4386590-bubur-telur-menu-balita-8m";
Oseng buncis dan orak arik telur;4 badan bawah lele + telur lele + kulit lele--5 bawang merah--4 bawang putih--1 ruas jahe--1 ruas kunyit--2 ruas kencur--2 daun jeruk--3 daun salam--3 serai memarkan--4 kemiri--Secukupnya garam krosok--65 ml santan kara dicairkan--Secukupnya Minyak kelapa--;Haluskan semua bumbu kecuali daun2 an dan serai. Sisihkan--Tuangkan minyak kelapa ke dalam wajan, biarkan tua..--Masukkan bumbu halus ke dalam wajan sambil diaduk2 masukkan daun salam, daun jeruk dan serai. Aduk rata.--Masukkan lele dan kulit lele aduk2 rata biarkan setengah matang.--Masukkan santan kara yang telah dicarikan.--Aduk2 rata sampai mendidih--Tes rasa dan siap dihidangkan...ç--;2;;;;;;;;;;;;;"Mangut Lele dan telur Lele #keto #ketofy #ketopad,4 badan bawah lele + telur lele + kulit lele--5 bawang merah--4 bawang putih--1 ruas jahe--1 ruas kunyit--2 ruas kencur--2 daun jeruk--3 daun salam--3 serai memarkan--4 kemiri--Secukupnya garam krosok--65 ml santan kara dicairkan--Secukupnya Minyak kelapa--,""Haluskan semua bumbu kecuali daun2 an dan serai. Sisihkan--Tuangkan minyak kelapa ke dalam wajan, biarkan tua..--Masukkan bumbu halus ke dalam wajan sambil diaduk2 masukkan daun salam, daun jeruk dan serai. Aduk rata.--Masukkan lele dan kulit lele aduk2 rata biarkan setengah matang.--Masukkan santan kara yang telah dicarikan.--Aduk2 rata sampai mendidih. Tes rasa. Mangut siap dihidangkan...ç--"",2,/id/resep/4370787-mangut-lele-dan-telur-lele-keto-ketofy-ketopad";
Semur Telur Mata Sapi/Ceplok;1/4 gram buncis--1 butir telur--10 cabai rawit--2 cabai hijau besar--3 siung bawang merah--2 siung bawang putih--Garam--Gula--Penyedap rasa(optional)--1 ruas lengkuas digeprak--1 ruas jahe digeprak--2 Daun salam--Kecap Manis--;Cuci buncis terlebih dulu lalu buang ujung nya--Iris miring tipis sisihkan--Rajang semua bumbu kecuali jahe dan lengkuas lalu tumis hingga harum, masukkan daun salam--Masukkan telur orak arik lalu masukkan buncis, kemudian kecap garam, gula, dan penyedap rasa--Koreksi rasa, jika sudah pas biarkan sampai matang tapi jangan over--Buncis orak arik telur siap di sajikan--;1;;;;;;;;;;;;;"Oseng buncis dan orak arik telur,1/4 gram buncis--1 butir telur--10 cabai rawit--2 cabai hijau besar--3 siung bawang merah--2 siung bawang putih--Garam--Gula--Penyedap rasa(optional)--1 ruas lengkuas digeprak--1 ruas jahe digeprak--2 Daun salam--Kecap Manis--,""Cuci buncis terlebih dulu lalu buang ujung nya--Iris miring tipis sisihkan--Rajang semua bumbu kecuali jahe dan lengkuas lalu tumis hingga harum, masukkan daun salam--Masukkan telur orak arik lalu masukkan buncis, kemudian kecap garam, gula, dan penyedap rasa--Koreksi rasa, jika sudah pas biarkan sampai matang tapi jangan over--Buncis orak arik telur siap di sajikan--"",1,/id/resep/4355177-oseng-buncis-dan-orak-arik-telur";
Sosis, Telur, Nugget Pedas Manis #KisahKasihCookpad;4 butir telur Ayam--2 lembar Daun Salam--1 batang Sereh--1 cm Lengkuas--1 cm Jahe--1/2 siung Bawang Bombay--2 sdm Kecap Manis--1 1/2 sdt Gula Putih--secukupnya Penyedap Rasa--secukupnya Garam--secukupnya Minyak--secukupnya Air--1 batang Bawang Daun--10 buah Cabe Rawit Hijau/Merah--3 siung Bawang Merah--2 siung Bawang Putih--7 buah Cabe Keriting Merah--;Panaskan minyak secukupnya. Lalu Goreng telur ayam hingga matang. Lalu tiriskan.--Haluskan bawang merah, bawang putih dan cabe. Bisa di blender atau di ulek.--Iris bawang bombay, bawang daun, lengkuas, dan jahe. Sereh di geprek saja.--Panaskan minyak secukupnya. Lalu masukan bumbu halus, lengkuas, jahe, bawang bombay, sereh, daun salam, dan bawang daun. Tumis hingga harum.--Setelah harum masukan air secukupnya. Aduk-aduk hingga matang.--Apabila sudah mendidih masukan penyedap rasa, garam, gula, cabe rawit, dan kecap. Aduk-aduk hingga mereta. Lalu tes rasa.--Setelah itu masukan telur ceplok nya. Aduk perlahan. Lalu tunggu beberapa menit agar bumbu meresap ke dalam telurnya.--Angkat, hidangkan ke dalam piring. Semur Telur Mata Sapi / ceplok nya siap di hidangkan dan di santap.--Selamat mencoba dan terimakasih.--;9;;;;;;;;;;;;;"Semur Telur Mata Sapi/Ceplok,4 butir telur Ayam--2 lembar Daun Salam--1 batang Sereh--1 cm Lengkuas--1 cm Jahe--1/2 siung Bawang Bombay--2 sdm Kecap Manis--1 1/2 sdt Gula Putih--secukupnya Penyedap Rasa--secukupnya Garam--secukupnya Minyak--secukupnya Air--1 batang Bawang Daun--10 buah Cabe Rawit Hijau/Merah (buat yg suka pedas)--3 siung Bawang Merah--2 siung Bawang Putih--7 buah Cabe Keriting Merah--,""Panaskan minyak secukupnya. Lalu Goreng telur ayam hingga matang. Lalu tiriskan.--Haluskan bawang merah, bawang putih dan cabe. Bisa di blender atau di ulek (sesuai selera). Klau saya di blender *biar praktis.--Iris bawang bombay, bawang daun, lengkuas, dan jahe. Sereh di beprek saja.--Panaskan minyak secukupnya. Lalu masukan bumbu halus, lengkuas, jahe, bawang bombay, sereh, daun salam, dan bawang daun. Tumis hingga harum.--Setelah harum masukan air secukupnya. Aduk-aduk hingga matang.--Apabila sudah mendidih masukan penyedap rasa, garam, gula, cabe rawit, dan kecap. Aduk-aduk hingga mereta. Lalu tes rasa.--Setelah itu masukan telur ceplok nya. Aduk perlahan. Lalu tunggu beberapa menit agar bumbu meresap ke dalam telurnya.--Angkat, hidangkan ke dalam piring. Semur Telur Mata Sapi / ceplok nya siap di hidangkan dan di santap.--Selamat mencoba dan terimakasih.--"",9,/id/resep/4385745-semur-telur-mata-sapiceplok";
Semur bali tahu dan telur;2 butir telur ayam--1 bh sosis, cincang halus--2 bh nugget goreng, potong--1 batang daun bawang, cincang--3 sdm saus sambal--1 sdm kecap manis--2 sdm Blueband--Secukupnya garam dan merica--;Siapkan bahan.--Panaskan Blueband, masukkan telur beri garam merica buat orak - arik.--Tambahkan sosis cincang, daun bawang cincang, saus sambal dan kecap manis masak sambil diaduk hingga matang merata.--Angkat dan hidangkan bersama nasi hangat.----;29;;;;;;;;;;;;;"Sosis, Telur, Nugget Pedas Manis #KisahKasihCookpad,""2 butir telur ayam--1 bh sosis, cincang halus--2 bh nugget goreng, potong--1 batang daun bawang, cincang--3 sdm saus sambal--1 sdm kecap manis--2 sdm Blueband--Secukupnya garam dan merica--"",""Siapkan bahan.--Panaskan Blueband, masukkan telur beri garam merica buat orak - arik.--Tambahkan sosis cincang, daun bawang cincang, saus sambal dan kecap manis masak sambil diaduk hingga matang merata.--Angkat dan hidangkan bersama nasi hangat.----"",29,/id/resep/4384866-sosis-telur-nugget-pedas-manis-kisahkasihcookpad";
Geprek Telur Bakso Sosis;500 gram kentang--2 buah wortel--1 batang daun bawang--2 butir telur rebus untuk isian--secukupnya Minyak goreng--Bumbu halus:--2 siung bawang putih--2 siung bawang merah--1 sdt lada--1 sdt garam--1/2 sct kaldu bubuk rasa ayam--Pelapis:--1 butir telur kocok lepas--100 gram tepung roti--;Potong kentang tebal 1 cm cuci bersih lalu goreng hingga kuning kecoklatan lalu dihaluskan--Potong wortel dadu kecil2 rebus sampai mendidih lalu tiriskan masukkan ke dalam adonan kentang bersama bumbu halus dan daun bawang yg sudah dicincang--Aduk sampai merata koreksi rasa..kalo sudah mantap dibentuk bulatan diisi dengan telur rebus yg sudah dipotong kecil2 sampai adonan habis baru di celupkan ke dalam telur yg sudah di kocok lalu di baluri tepung roti sambil ditekan2 agar tepung rotinya menempel sempurna--Lalu goreng dengan api sedang...saya membaliknya cuma sekali soalnya biar ttp cantik bentuk kroketnyaÑ--Setelah kuning kecoklatan angkat tiriskan dan kroketnya siap disajikan--;8;;;;;;;;;;;;;Kroket kentang wortel isi telur rebus,500 gram kentang--2 buah wortel--1 batang daun bawang--2 butir telur rebus untuk isian--secukupnya Minyak goreng--Bumbu halus:--2 siung bawang putih--2 siung bawang merah--1 sdt lada--1 sdt garam--1/2 sct kaldu bubuk rasa ayam--Pelapis:--1 butir telur kocok lepas--100 gram tepung roti--,Potong kentang tebal 1 cm cuci bersih lalu goreng hingga kuning kecoklatan lalu dihaluskan--Potong wortel dadu kecil2 rebus sampai mendidih lalu tiriskan masukkan ke dalam adonan kentang bersama bumbu halus dan daun bawang yg sudah dicincang--Aduk sampai merata koreksi rasa..kalo sudah mantap dibentuk bulatan diisi dengan telur rebus yg sudah dipotong kecil2 sampai adonan habis baru di celupkan ke dalam telur yg sudah di kocok lalu di baluri tepung roti sambil ditekan2 agar tepung rotinya menempel sempurna--Lalu goreng dengan api sedang...saya membaliknya cuma sekali soalnya biar ttp cantik bentuk kroketnyaÑ--Setelah kuning kecoklatan angkat tiriskan dan kroketnya siap disajikan--,8,/id/resep/4384936-kroket-kentang-wortel-isi-telur-rebus;
Orak arik telur saus pedas gurih;4 telur--2 tahu uk besar --Gula merah--Kecap manis--2 daun salam--Gula garam dan royco--Bahan halus:--5 cabe merah besar--4 bawang merah--6 bawang putih--1 ruas jahe--2 kemiri--Sedikit tomat potong--;Rebus dulu telur nya sampe matang lalu tiriskan. Dan potong tahu nya dan tiriskan--Goreng telur bulat dan goreng setengah matang tahunya--Lalu blender semua bahan halusnya--Masukan semua bahan halus ke minya goreng masukan daun salam ny juga.--Lalu kasi bumbu royco gula garam dan kecap dan gula merah--Masukan telur dan tahu yg sudah di goreng aduk sebentar,masukan air 1 gelas kecil--Diam kan beberapa saat sampai air menyusut.--Selamat mencoba--;8;;;;;;;;;;;;;"Semur bali tahu dan telur,4 telur--2 tahu uk besar aku potong segitiga kecil--Gula merah--Kecap manis--2 daun salam--Gula garam dan royco--Bahan halus:--5 cabe merah besar--4 bawang merah--6 bawang putih--1 ruas jahe--2 kemiri--Sedikit tomat potong--,""Rebus dulu telur nya sampe matang lalu tiriskan. Dan potong tahu nya dan tiriskan--Goreng telur bulat (skip) dan goreng setengah matang tahunya--Lalu blender semua bahan halusnya--Masukan semua bahan halus ke minya goreng masukan daun salam ny juga.--Lalu kasi bumbu royco gula garam dan kecap dan gula merah--Masukan telur dan tahu yg sudah di goreng aduk sebentar,masukan air 1 gelas kecil--Diam kan beberapa saat sampai air menyusut.--Selamat mencoba--"",8,/id/resep/4384727-semur-bali-tahu-dan-telur";
Telur dadar isi ayam wortel;10 buah bakso--2 butir telur--4 buah sosis potong potong sesuai selera--25 buah cabe rawit--3 siung bawang putih--4 siung bawang merah--Garam--Minyak goreng untuk menumis--;Goreng bakso dan sosis hingga berwarna kecoklatan--Kocok telur dan goreng menjadi telur dadar--Ulek kasar cabe rawit, bawang putih, bawang merah dan garam--Penyet bakso, sosis dan telur di cobek--Tumis penyetan sebentar--siap disajikan;3;;;;;;;;;;;;;"Geprek Telur Bakso Sosis,10 buah bakso--2 butir telur--4 buah sosis potong potong sesuai selera--25 buah cabe rawit--3 siung bawang putih--4 siung bawang merah--Garam (sesuai selera)--Minyak goreng untuk menumis--,""Goreng bakso dan sosis hingga berwarna kecoklatan--Kocok telur dan goreng menjadi telur dadar--Ulek kasar cabe rawit, bawang putih, bawang merah dan garam--Penyet bakso, sosis dan telur di cobek--Tumis penyetan sebentar--Taraaaaa...jadi deh...--Santap dengan nasi hangat...kenyang deeeh..Å--"",3,/id/resep/4377731-geprek-telur-bakso-sosis";
Terik Tempe & Telur;5 butir telur ayam--2 buah cabe merah besar--2 buah cabe hijau besar--1 buah tomat--3 siung bawang putih--1/4 potong bawang bombai--3 sendok makan mayones--3 sendok makan saus tomat--1/2 sendok teh gula--1 sendok makan kecap asin--Secukupnya garam dan merica--;Orak arik telur dengan api sedang, tambahkan garam jika ikin telurnya lebih berasa. Sisihkan.--Rajang halus, bawang putih, bawang bombai, Cabe merah besar, dan cabe hijau besar. Serta tomat potong dadu kecil saja.--Siapkan penggorengan, beri sedikit minyak untuk menumis. Atau bisa menggunakan mentega. Sesuai selera.--Masukkan cincangan bawang putih dan bawang bombai. Api sedang. Aduk hingga wangi. Tidak perlu sampai coklat.--Masukkan rajangan kedua cabe. Aduk. Masak hingga tercium aroma wangi. Kecilkan api.--Masukkan mayones dan saus tomat, lalu kecap asin dan gula. Aduk rata.--Tambahkan garam dan merica secukupnya, aduk lalu cek rasa.--Masukkan telur aduk rata, api sedang, masak hingga berasap. Jangan sampai kering.--Siap disajikan dengan nasi hangat, bubur, atau bubur oat. Selamat menikmati.--;5;;;;;;;;;;;;;"Telur balado,6 butir telur rebus--Bumbu:--3 siung bawang putih--8 siung bawang merah--10 buah cabai merah--1 ruas jahe--1 ruas kunyit--3 butir kemiri--3/4 sdt lada bubuk--Garam--Gula merah--secukupnya Penyedap rasa--Air--,""Rebus telur dan kupas--Haluskan semua bumbu kemudian tumis hingga harum--Masukkan sedikit saja air (satu gelas), masukkan gula merah dan penyedap rasa sesuai selera--Setelah gula merah larut, masukkan telur dan masak hingga air menyusut--Telur balado siap dihidangkaaan--"",6,/id/resep/4372266-telur-balado";
